Title,Detail,Rating
파라다이스 위 프라이빗한 대저택,"파라다이스에 지어진 대저택에 살다온 기분이었어요.  200여개가 넘는 방과 몇십개의 레스토랑, 다이브샵, 심지어 테니스장까지 구비된 이루푸시 리조트는 몰디브에서 가장 큰 리조트 중 하나라는 명성에 걸맞게 온갖 종류의 편의시설이 구비된 하나의 성 같았어요.  이루푸시가 인상적이었던 이유는 개인 집사 서비스가 있어서, 필요한 것에 대해 언제든지 문자를 보내 빠르게 응답받을 수 있다는 것이었어요. 큰 리조트임에도 불편함 없이 그저 즐기기만 하면 되는 시스템에 내가 마치 미국드라마 안투라지의 주인공이 된 것 같았어요.  바다는 투명한 에메랄드 빛, 내륙은 초록초록한 코코넛 나무들이, 바닥은 곱고 하얀 모래가. 꿈에 그렸던 파라다이스 그대로였어요. 특히 리조트 내 또하나의 리조트 같은 스파는 특유의 꽃내음과 함께 릴렉스되는 마사지로 몰디브까지 여정의 피로를 제대로 풀어주었어요. 매년 상을 받았다고 해서 얼마나 좋을지 기대했는데 기대만큼 정말 좋았고 힐링되는 시간이었어요.  저희 커플은 스노클링, 프리다이빙을 워낙 좋아하는 터라 스노클, 핀 장비도 다 챙겨 다니는데 이 리조트는 건강한 니모 군락을 가지고 있고 다른 다이빙 투어에서도 보기 힘든 너스샤크도 리조트 바로 앞바다에서 만날 수 있어서 특히 너무 좋았습니다.   다이빙을 다 끝내고 바다에 연결된 발코니를 통해 집으로 올라오면, 발코니에 구비된 따뜻한 자쿠지에 그대로 들어가 그날의 선셋을 감상했어요. 그때 본 선셋의 느낌과 기억은 이 여행의 베스트컷으로 남아있습니다.  몰디브 바다 한 가운데 프라이버시가 보장된 이 리조트는 방에만 있어도 너무",5.0
"어떤 방식을 원하던, 바라던 모든 것을 충족시켜주는 리조트!","선셋 호라이즌 비치 빌라에서 올인클루시브로 묶었습니다. 방 바로 아래 펼쳐진 아름다운 산호초를 바라보다 발코니 따듯한 자쿠지에 누워 샴페인을 마시며 석양을 바라보곤, 해변의 레스토랑에서 해산물 바베큐를 먹으며 하루를 마무리하는 멋진 시간을 보냈습니다.   너스샤크를 비롯해, 트레발리, 니모, 패럿 피쉬, 나이젤 트리거피쉬에서 파우더탱까지 주변 산호와 바다 생물들이 건강한 모습을 하고 있는 것도 정말 좋았습니다.   모든 게스트에게 제공되는 프라이빗 버틀러 서비스를 제외하고서도, 엄청난 규모의 객실을 가진 리조트임에도 불구하고 직원 한명 한명이 게스트들의 이름과 방을 모두 외우고, 일정을 기억해주며 한명 한명 맞춤 서비스를 제공해주는 것도 정말 좋았습니다!   강추!!",5.0
Irufushi is best♡!!!!!정말최고의여행이였어요,너무행복했어요 신혼여행으로왔는데 매매일이 너무아쉽고즐거웠어요 또 허니문이라고 계속 작은이벤트해주시는데 감동이고 직원분들너무귀엽고 친절하고 다했습니다 넘 조아요♡♡추천해요,5.0
꿈같았던 이루푸시 몰디브 여행,"꿈같았던 몰디브 이루푸시 여행.  숙소로 정한 워터빌라는 내가 그동안 여행하면서 경험해보지 못했던 새로운 신세계였다. 친절한 직원들과 잘 갖춰진 부대시설 훌륭한 수중환경 최고라고 할수있는 워터빌라숙소까지, 다시 가고싶다 이루푸시. 최고였다.",5.0
몰디브에서 제일 많은 레스토랑을 보유한 리조트,"우기가 아니었음에도 여행기간 내내 비가 내렸다. 다행히 리조트에서 12개의 다양한 레스토랑을 보유하고 있어서 이태리, 프렌치, 타이, 아메리칸 다양한 식사를 하며 시간을 보낼 수 있었다. 직원들은 대부분 친절하고 특히 레스토랑 직원들이 매우 친절하다. 비가와서 상어무리를 못본 우리에게 다른 종류의 물고기를 보여주었다. 다만 우리를 담당한 버틀러만 제외하고 모두들 친절했다.   룸 내에서 USB나 CD를 통해 영화를 볼 수 없는 점은 매우 안타까웠다.",4.0
도난사건,"여기서 있었던 현금도난 사건에 관해 오래전에 리뷰했는데 등록이 되지 않는군요. 다시 씁니다!!  절대 금고외의 곳에 가방을 맡기지 마세요. (water villa포함). 가방속에 있던 지갑의 현금을 몽땅 도둑맞았습니다. 직원 중 한명이 범인이라고 생각하지만 호텔측에서는 아무런, 정말 아무런 조치도 없었습니다. 아래 리뷰에서도 같은 경험을 한 여행자가 있는 것으로 보아 손버릇이 나쁜 직원이 한명 있는가 봅니다.   자쿠지에서는 오랫동안 일광에 노출되어서 그런지 플라스틱(녹는) 냄새가 나서 별로 이용하지 않았습니다. 파도가 수상방갈로에 접한 바다쪽은 파도가 제법 센편입니다. 객실 내의 오디오 시스템은 좋았던 점 중 하나입니다. 조식은 구색은 갖추고 있지만 맛있는 것은 없었으며 태국레스토랑이 제일 먹을만 하다고 생각합니다.  이 리조트는 손버릇 나쁜 직원관리가 가장 문제이겠네요.",1.0
도둑맞음. 최악 최악 최악.,"힐튼 몰디브 Iru Fushi로 신혼여행 갔습니다. 1주일 있었고요. 도착했을 때 Water Villa 데스크에 맡긴 가방 안에 지갑을 넣어두었는데, 이후로 돈을 쓸 일이 없기 때문에 일주일 동안 지갑을 거기에 둔 것도 잊었습니다.  마지막 날에 여행가방을 챙기면서 지갑을 찾아보니 지갑과 현금이 없어졌습니다! 1,000유로를 도둑맞았습니다.  매니저와 이야기를 하니 보안 책임자와 경찰이 섬으로 왔습니다. 예정된 마사지도 못 받고 마지막 날을 최악으로 보냈지만, 호텔 측에서는 어떤 식으로도 전혀 배려가 없었습니다.  경찰에 접수만 하고 호텔 비용은 전부 내야 했습니다.  힐튼호텔 여러 곳을 가 봤지만 이런 문제는 단 한 번도 없었습니다. 몰디브에 가면 보통 신혼여행으로 가는 것이고 쉬러 가는 건데...이건 악몽입니다.  어떻게 최고급 호텔이고 섬인데 이런 일에 대해서 전혀 배려나 대응이 없는지 이해가 안 됩니다!! 매니저는 모든 것이 수사 중이고 나중에 진행 상황을 알려준다고 했습니다..하지만 5개월이 지나도록 연락이 없습니다. 최악입니다.",1.0
몰디브란 이런 곳이야!! 느낌의 리조트,"디럭스 비치 빌라에 숙박. 객실은 넓고 쾌적. 밖으로는 객실과 같은 넓이에 전용 제트바스. 샤워부스(두곳), 세면실, 화장실이 있습니다. 정말 멋진 공간입니다.  비치와 풀장 모두 사람이 없어 여유있는 시간을 보냈습니다. 저녁은 빨리 예약을 해둬야합니다. 그때 기분에 따라 먹지 뭐...하다가는 가고 싶은 레스토랑은 벌써 꽉차서 못들어 가는 경우가 있었습니다. 결국 뷔페 레스토랑으로 갈 수 밖에 없었지요.(뷔페는 예약 필요 없음)  이 리조트는 수상 비행기를 타지 않으면 갈 수 없는 곳이지만 그것 또한 멋진 경험이 됐습니다. 수상 비행기 터미널의 힐튼 전용 VIP 대기실이 준비되어 있고 그곳에서 탑승시간까지 음료나 가벼운 식사를 즐기며 기다리면 됩니다. 수상 비행기 안에서는 아래로 산호초 가득한 바다를 볼 수 있는 최고의 경험을 했습니다.",4.0
순수한 천국,"Iru fushi 7일 밤을 묵었는데 sun siyam 제가 신혼여행이 되어서 정말 기쁩니다. 공항 라운지에서 마시는 이별의 액세스할 때까지, 우리는 이 리조트에서 작업을 모두 친절하게 느껴지지 었다. 우리가 묵었던 워터 빌라는 순수한 럭셔리. 객실은 아름답게 디자인 되고 직접 액세스를 제공하는 라군과 야외 데크가 있는 곳에서 진정 개인. 가장 큰 놀라움을 주는 음식 이었어요. 해 하고 있는 일은 하지 않을 수 있습니다 포로 관객 의 수준 높은 음식 할 수 있습니다. 맛 좋은 모든 것을 우리는 놀랐습니다. 이 리조트는 여러 레스토랑. 인도에서 먹은 맛 (우리가 제일 좋아하는, 이 트리오 (이탈리아), 뱀부 아일랜드의 그릴 (해산물) 및 베트남어). 정말 즐거운 저녁 식사 이 한 뷔페식 아침 식사는 다양한 종류의 차갑고 뜨거운 매일 바뀌지 제품들을 보관하는 것. 이 리조트는 아름다운 일몰을 볼 수 있는 성인 전용 수영장이 있다. 이 리조트는 각 객실에 객실 담당자 및 도움말 링크를 통해 책임사용자는 매일 섬에서 즐거운 경험. 지라 일, 집사, 매우 친절하고 도움이 되었습니다. 그는 정말 한 가장 좋은 시간을 가지도록 해. 내 아내는 사소한 문제이기는 하지만 온천 해결되었습니다. 한 해변 이 섬에 있는 완벽한 그림. 여러 사람들이 우리가 일주일에 하는 것이 몰디브 를 사용하면 할 것. 해양 스포츠를 즐길 수 있는 다양한 활동을 하고 있고 오락실 에서 게임 콘솔에서 편안하게 묵을 수 있는 두 번째 줍니다. 순수한 천국!",5.0
사람들은 놀라운 장소 &,"필자는 수많은 섬을 방문하는 놀라운 경험이 태평양 과 카리브 해의 비교 대상이 없음. 친절한 직원들은 매우 친절하고 도움이 되었습니다. 7개월 된 아기 를 들을 수 있는 특별한 주의를 준 그녀. 두 번째 평면에 발을 디딜 어 같은 느낌을 받는 놀라운 서비스. 릴리 패키지를 선택했는데 저희가 해변의 빌라에서 3일을 2 일 과 워터 빌라. 이는 가장 좋은 방법은 두 옵션 모두 그러길 정말 잘한 게 했다. 뷔페식 아침 식사와 저녁 식사는 훌륭한 거대한 선택. 시설 정보와 편의 시설이 화려한. 정말 추천 할 곳이 없는, 5성급 호텔과 리조트들이 이 호텔은 세계에서 가장 좋은 경험을 하는 동안 이 다. 개인적인 라운지에서 시간을 보내는 동안 바다를 바다 비행기 완료될 때까지 기다립니다. 이는 훌륭한 시설과 뷰, 샤워 시설 및 욕조가 있는 거대한 비 알코올 음료 무료 뷔페 선택할 수 있습니다. 또한 개인적인 수집 및 드라이브를 남성 운전 기사를 공항에서 5분 정도 떨어진 곳에서 기다리는 동안 라운지에서 45분 수상 비행기를 타고 럭셔리 함에 리조트 입니다. 스파는 아름답다고 생각하는 합리적인 가격의 거대한 양의 처리 옵션을. 나는 작은 양의 조사 후 우리는 예약을 한 이후에 궁금해 할 것이지만 다른 리조트를 선택하는 경우 다음 을 선택한 것이 확실하게 하고, 우리가 한 정류장에서 내려서 집으로 가는 길에 다른 리조트 직원들은 이 호텔처럼 고급스러움. 고마운 사람 이 휴가를 손꼽아 기다리고 있는 오! 또한 몰디브로 술을 가지고 우리 것은 이륙 yiu 수를 공항에서 떠날 때 에, 우리가 이 법에 없는",5.0
내 신혼 여행,"대나무 라는 웨이터의 무례 rehaan 첫 번째 및 두 번째 일은 하우스 키핑 담당자는 미소를 짓고 있기 때문에 제가 너무 무례 하지 않지만 그는 "" 좋은 아침 "" 을 여러 차례 답변을 하지 않습니다! 그래서 저는 교체할 수 있습니다.  마지막으로. Iru fushi sun siyam 호텔에 아주 행복한 감사합니다,  압둘라 유세프",4.0
홀리데이,"빨리 또 가고 싶은 여행, 떠나야 했을 때 매우 슬픈 일. 이 모든 것들이. 예약 해서 이 2018, 직원들은 길을 맞이하는 것, 또한 일부 활동하고 다음 방문.",5.0
몰디브 최고의 리조트 ,나는 더 이상 이곳에 머물 생각 이었어요. 이 리조트는 매우 잘 새롭게 설계된 최신 기술 및 인테리어 디자인. 버틀러 서비스는 서비스 직원들은 특별하고. 찾을 수 없는 몰디브 리조트보다 더 좋은 것입니다. 제가 묵.,5.0
환상적인 곳! ,"우리가 머무는 동안 아들은 조금도 그 양복을 입고 있는 10 일 동안 많은 것들을 할 수 없습니다 입니다. Iru fushi 에 있는 것을 알게 할 수 있는 많은 활동을 할 것 같은 (아쿠아 스포츠 의 장르, 라켓 스포츠도 있다 레크리에이션 센터 들이 할 수 있습니다 그리고 많은 다양한 활동과 같은 탁구, 당구 .). 아주 좋은 숙박 이 총 이 있는 스파를 설치하는 것은 호텔의 직원들은.  감사합니다!",5.0
진정한 천국,"기대 이상 입니다. 내 아내와 나는 우리의 신혼여행은 24시간 후에 체크인을 하는 편한 의 서비스, 훌륭한 음식, 시설과 아일랜드 리조트의 아름다움을 더 faboulous. 디럭스 비치 빌라에 반해 야외 욕실은 자쿠지 및 수영장 근처의 화이트 샌드 비치 백! 우리는 우리의 일을 대부분 쉴 수 있는 야외 침대 에 우리 빌라의 세가지. 직원들은 너무나 따뜻하고 친절한 서비스를 제공하는 등 모든 작은 아주 특별한 곳이 감독관이기도 했습니다. 하는 걱정이 되지만 포함된 모든 항목을 포함하는 / 제외된 을 곧 발견 이 필요 없어 나갈 수 있는 거대한 범위 선택; 하고 가는 것은 우리는 랍스터 bbq 저녁 식사는 하지 않는 것도 있지만 기타 컨텐츠를 범위 패키지를. 우리는 신혼여행을 선택한 후 필요한 작업과 함께 일 년 계획에 대한 우리의 결혼식.",5.0
놀라운 아무것도,"워터 빌라는 환상적이고 놀라운, 청결이 exceptioal. 정말 멋진 개인 집사, shabeen, 참석해 우리의 요구 이다. Mastooq 의 벨 서비스를 타고 도착 할 때도 손으로 도움을 제공하지 않아도. 직원들은 정말 친절하고 도움이 되고 있다. 모든 것이 완벽한, 말 그대로 천국 이다.",5.0
파라다이스 발견,Iru fushi 엄마와 저는 sun siyam 휴가를 보내는 정말 낙원 처럼 느껴지는! 이곳에 있는 동안 많은 것을 말한다. 조용하고 친절한 직원들은 어떻게 이곳을 매우 놀라게 하는. 우리를 편안하게 한 순간부터 저희 엘리아 오프 강화 배 떠날 때까지. 하지만 안타깝게도 우리의 첫 번째 문제는 한 분이 친절하고 알리는 빌라 변경하려면 다른 빌라. 나중에 온 모든 것도 확인할 수 있었습니다. 놀랍게도 우리가 예약한 디럭스 비치 빌라는 개인 수영장이 딸린 편안한! 우리의 마음에 드는 식당에서 아침 식사할 수 있는 탁월한 선택을 하는 인도의 맛! 스파는 최고의 스파 체험을 하면서! 몰디브 iru fushi siyam 을 할 수 있는 일을 추천 합니다. 꿈을 꾸지 사용자_이름:. 영원히 떠날 때 바로 얘기할 수 있지만. Iru fushi sun siyam 의 모든 것에 감사 드립니다! ,5.0
가족을 위한 파라다이스!,"우리는 이 멋진 리조트에서 7월 7일 - 7월 14일. 우리는 해변의 빌라에 개인 수영장까지. 방은 훌륭했고 개인 수영장이 바로 우리가 우리 자신의 앞에 있는 해변이 다. 음식도 훌륭했고, 대나무 철판 구이 했습니다. 우리가 우리의 호스트 및 해당 체크 아웃 연장 jauzee 출발 공항 라운지 부터 떠날 때까지 남자를 예약을 해 주었습니다. 주방장이 요리 해 주는 공항 라운지에서 멋진 식사. 가격도 적당했고 음식과 음료는 리조트에서 모든 식사 옵션 을 시도해 봤는데. 전반적으로 마음에 드는 경험이 내년 10박 예약을 할 때는 7 일 후 집에 와서 싶지 않았다. Sun Siyam 감사합니다.",5.0
좋은 경험,"매우 근사한 리조트, 조용한, 안전하고, 지원 직원, 맛있는 음식, 재미있는 활동, 자연 장소, 관심 있는 개인적인 분위기를, 할 수 있는 신혼 여행을 위한 좋은 계획 들의 가상화와 것이 좋습니다.",5.0
파라다이스 ,"이 곳은 파라다이스 섬. 아름다운 해변, 무성한 정원, 맛있는 음식과 환상적인 직원들은 이 놀라운 가치가 있습니다. 예 저렴하지. 하지만 값어치를 합니다! 아이들이 떠난 뒤에 (하지만 저는 기꺼이 다시 가볼 수 있어서 아이들이 너무 훌륭한 시설의 화려한 가족 옵션). 우리는 인사를 이용한 우리 방에서 집사 카운티까지 버기를 타고 우리를 체크 (줄이 긴 여행 후 없음). 나는 방을 말한다. 이 수영장은 광대 한 해변의 빌라! 바람이 잘 통하는 깨끗하고, 사랑스럽고 멋지다.  화려한 아침 식사 후에 우리가 있는 동안 내내 매일 다양한 섬 가진 하우스 키핑 직원은 우리 빌라는. 약 20 $을 잘못 ealk 원주를 왕복하는 해변! 매일 아침 대규모의 정원사 모든 맥시 걸어서 아침 식사 요. 모든 직원은 친절하고 예의바르 았습니다.  모든 음식이 훌륭하고 음식도 좋은 편이 피자를 선택 와규 등심 스테이크. 우리는 대부분의 식사는 이탈리아어, 프랑스어 및 그릴 레스토랑 (때문에 까다로운 먹는 파트너! ) 은 작은 섬들이 광대 한 와인 리스트도! 이 조용한 시간을 보내고 있는 처음 몇 일 동안 꽤 해변을 보지 않을 것입니다. 우리의 사랑스러운 수영장은 따뜻하고 편안한 휴식을 하는 중에 가장 lavastone. 있는 것 이었지만 아무도 강요 할 수 있는 경우 추가 제품을 계속 판매할 수 있습니다. 저는 정말 이 곳 사람들에게 아름다운 장소 중 한 후에 가족 휴가. 저는 돌아가 설명하겠습니다!",5.0
완벽한 경험,"여기가 처음인 섬, 정말 아름다웠어요! 비치빌라는 완벽했습니다! 두 번째 안에 있는데 무엇인가, 관리자 및 직원이 잘 되어 있어. 전체적으로 만족 할 수 있고 친구들 이었기 때문에 추천 합니다.",5.0
우리가 숨을,"이 리조트의 아름다움을 단어 수 없습니다. 절제 하는 파라다이스 입니다. 이 호텔의 가장 큰 장점 의 단순성 이 완벽하게 혼합한 자연 환경 아키텍처를 제공합니다.  호라이즌 워터 빌라는 아주 좋습니다. 스파는 환상적인. 또한 신중한 서비스는 훌륭했고, 마치 집에 있는. 음식도 맛있었고, 특히 이탈리아 레스토랑의 점심 식사는 특별한 피자. 우리의 서버, ridho, 좋았습니다. 그는 우리의 신혼 여행은 아주 특별한 휴가. 우리는 항상 미소와 좋은 태도를 만나고 있는 좋은. 최고의 서버 중. 우리는 이 리조트를 떠나야 했을 때 말 그대로 우는. 환상적인 신혼여행이었고, 한계를 극복한 질문: 수 시간 을 때 보다 더 좋은 곳은?",5.0
묵었던 최고의 리조트 입니다.,"모든 서비스 및 시설 내 기대 보다 더 좋은 곳. 저희는 워터 빌라로 업그레이드 호라이즌 빌라. 우리의 결혼 기념일을 축하하는 특별한 서비스가 있습니다. 우리는 놀라운 마음을. 저희는 리조트의 레스토랑. 트리오, 아일랜드 그릴 및 인도 레스토랑 중 최고 다. 작업 센터는 호의를 베푸는 내 아들이 있는 곳이 다.",5.0
훌륭한 리조트,"가장 기억에 남는 여행. 훌륭한 리조트, 훌륭한 전망, 좋은 직원들과 훌륭한 인피니티 풀 워터 빌라. 우리 빌라가 마음에 들었습니다.  이곳은 스쿠버 다이빙, 수영 해도 방법을 알 수 없습니다. 그냥 놀라운 산호초.  비수기 다. 적은 사람들, 오히려. 하지만 비가 오는 날씨 이 있는 한 번 더 하지 않으면 뜨거운 태양 같은 것. 이 더운 여름에 머리카락이 있는 동안 정말 있을 것이다.",5.0
놀라운 경험,"이 멋진 휴가를 보냈습니다. 환상적인 화이트 샌드 비치, 훌륭한 직원들이 좋은 품질 정보. 전 완전히 이 호텔을 추천.  우리는 이 호텔을 이용하는 수상 비행기 환승 라운지에서 공항까지. 직원, 음식과 서비스는 완벽한 곳이 다. 압둘라 nashid 감사 (라운지 수석 주방장) 그 사람은 항상 친절하고 좋은. ",5.0
"놀랍게도 편안한, 사랑하는 모든 분들이 화려한 곳","우리는 한 sun 작년 크리스마스 하는 이곳이 너무 좋아서 siyam 하는 크리스마스와 새해 2주 하고 책이 오. 멋진 리조트였고, 우리는 가족이 정말 마음에 드는 사람이 디럭스 비치 빌라 와 수영장. 일광욕을 할 수 있는 비치, 플런지 풀장 으로 너무 뜨거운 경우, 베란다에서 밖에 원형 해변 의자에 앉아 잠 들 수 있습니다. 덕분에 우리는 좋은 음식은 환상적인 스노클링과 물고기와 거북이도 놀라운 개인 여행으로 가장. 내 남편과 나는 이 리조트는 몰디브에 여러 번 방문 한 적이 있지만 완벽한 평화로움과 휴식이 있는 가족 여행. 다시 오고 싶어요!",5.0
"좋은 곳 - 친절한 직원들, 훌륭한 전망","가 서 - 계절 이 기 때문에 리조트가 붐비지 않다, 직원들이 정말 좋은. 이 질문에 답변하는 사람. 예약을 할 수 있는 모든 항목을 포함하는 가장 비싼 음식을 볼 - 모든 항목을 포함하는 음식이 좀 더 있었으면 좋겠다는 옵션을 선택할 수 있습니다. 뒤뜰에 작은 풀장이 있는 비치 빌라. 거의 완벽한 날씨 였다.",5.0
"좋은 곳, 전망, 서비스, 음식, 룸","모든 것이 놀라운 곳 도 가족과 커플들에게 적극 추천 합니다. 놀라운 경치, 서비스가 아주 좋고, 모든 사람들이 모든 것을 여기에 해 주었고 늘 미소를",5.0
지상 낙원,제가 사랑하는 내에서 이루지 푸쉬! 진정한 아름다움과 친절함이 가장 좋은 곳을 경험할 수 있는 몰디브. 저는 꼭 이곳에 올 걸지 사용자_이름:. 전체적으로 몰디브의 태양 이었다고 할 수 있는 최고의 장소로 이루지 푸쉬 siyam.,5.0
꿈의 대상 ,"이루지 푸쉬 나와 내 가족들에게는 좋은 경험. 들 이 친절하고 도움이 많이 되었습니다! 높은 수준의 음식이 맛있는 레스토랑들이! 특히 서비스는 기대 이상 및 키즈 클럽, 레크리에이션 및 스파!   항상 전화가 없지만 하나였고 좋은 것들이 떨어져 있고 말할 수 있는 리조트! 확실한 것은 모든 사람이 다! 이는 궁극적인 꿈의 대상! 저는 특별히 아름다운 해변이 결혼식 준비 방법 또한 목격 이 신혼 여행! 정말 마음에 들어요",5.0
마루 하바 천국! ,"저는 제가 원하는 몰디브로 가는 19살. 마침내 저는 20 년 간, 지상낙원! 환상적인 경험이었고, 다음에 도착한 남자로 부터 해서 말레 공항 라운지에서 iru, iru 라운지는 편안하고, 깨끗하고, 바다 전망이 훌륭한 비행기, 멋진 편안한 휴가에 도착한 후에 시작하는 방법 - 하울. 바다 비행기 여행 은 그 자체로 좋은 경험, 멋진 보석 을 봅니다 - 인도양의 섬처럼 곳곳에 - 마법.   45 미뉴에트 iru 에 도착한 후 - Fushi, 땅으로 나온 iru 평면을 볼 수 있습니다 - Fushi 는, 터키석 물 과 하얀 산호 모래 사장으로 둘러싸여 있으며, 실제로 내가 숨을 곳 이 풍경, 저는, 앞으로 한 오랜 꿈의 진정한. 맞이해 주었고 야비한, 우리 시설들이 갖춰져 있는, iru 빌라들 이라고 하는, 그러나 나는 안내. 멋지고 환영 개인 섬, 아주 특별한 느낌이 있을 것. 참 야비한, 우리는 24시간 동안 그는 한 해, 와! 우리의 숙박을 특별하게 해 주 야비한!   체크 인은 순조롭고 번거 로움 무료, 상쾌한 음료 를 통해 수행하는 동안 붕삼란에 모서리에 체크인 - 프로세스, 바다가 보이는, 놀라운! 우리 빌라, 아름다운!   시는 6 일 대한 iru (제 남편과 저는 더 생각이었고, 그 다음 이! ) 우리가 머무는 동안, 우리는 20분 정도 에 밖에 앉아 선라운지, 두말하면 잔소리! 우리는 이 시간을 즐기고, 5 - 6 시간 이나. 하우스 리프 에 가 필요하지 않은, 우리는 호수 에서는 스노클링, 오른쪽에 있는 프랑스 레스토랑 (바다가 보이는 경우) 와, 와우, 와우! 그래서 많은",5.0
함께 온 행복,"놀라운 것은 이 곳은 직원들의 따뜻함이 다음 을 더 해 주고 특별한 숙박.   하지만 수상 결과 에서 반환 은 천연 엉망이지만 직원들은 친절한 정렬 문제를 예기치 원치않게 로소아닐린을 제조 합니다  그 모자 떨어져, 직원들 또한 최고의 환대를 제공이 이루지 푸쉬  많은 사랑  무 케르 지 Subhankar",5.0
폴 oconnell,"Iru fushi 로 제가 세 번째 시간이었고, 우리는 모두 방문 전 재직 기간 동안 힐튼 호텔. 저는 약간 불안 지원하지만 변경 사항 관리를 하면 문제의 이전 방문 예약 에이전트가 모두 기대 이상 입니다. 두바이에 있는 듯 해서 로컬 에이전트 리조트 간 몇 가지지 문제가 있습니다. 도착했을 때는 처리 후 하루 뒤에 받은 풀장이 있는 패밀리 워터 빌라로 업그레이드! 모든 직원들은 훌륭하고 꼭, 한 팀에게 감사드려요.",5.0
