Title,Detail,Rating
놀라운! ,"저희는 이 리조트 신혼여행으로 이곳은 완벽한 it, 처음부터 끝까지 잘 보살펴 주는. 워터 빌라 강력 추천합니다, 특히 프라이버시, 스노클링을 언제든지 개인 덱크의 그냥 바로 아래 단계를 수행하십시오. 저는 다른 리뷰들처럼 전체 보드 예로 하는 음식과 음료가 비싼, 음료가 포함되지 않은 건지, 심지어는 미친 요금이 되어 있다. 예 를 수행하지 않은 경우에 조사한 수상 비행기 (한 사람당 $500) 합니다. 하지만 전반적으로 비싸도 충분히 즐길 수 있는, 음식은 항상 좋은, 뷔페 레스토랑, 마음에 드는 것은 우리의 개인적인 트리오. 나는 이곳을 반드시 추천할 것입니다, 만약 책이 생각이! 제가 가기 전에 약간 긴장되었지만 몇 몇의 후기를 보고 실망시키지 않는, 서비스와 화려한 곳이었어요!   가격 음료와 바다를 볼 수 있을 정도로 비행기를 관리, 더 많은 고객의 관심을 때문이다.",5.0
"예, 할 수 있는 지상낙원!","몇 가지 일을 할 때는 휴식을 취할 수 있는 대우 이며 매우, 더 좋은 곳이다. 위치 perfcet - 이미 수상 - 비행기는 놀라운 여행 - 좋은 식당들 (특히 트리오 (이탈리아)) 및 모든 종류의 수상 스포츠를. 스노클링 투어를 할 수 있는 것을 잊지 한 산호초 koral. 객실은 넓고 내 위에 거품 목욕 직접 watervilla 참조하십시오. 더 많은 것을 말하고, 이동 simoy, 프링 만 하자면!",5.0
행복한 일,"우리는 일요일에 도착해서, 바다 비행기 이동, 체크인을 효율성을 놀라운 방, 음식의 질에 레스토랑, 수정같이 맑은 물, 다양한 생선 라이브 영역으로 리프, 친절한 직원들은 매일 의 가장 중요한 것이 가장 기억에 남는 휴가 중 하나 막론한 모든, 예 술은 마실 수 없고 비싸긴 하지만!  물론 제가 ' 뜨거운 욕조가 있고 time machine ' 에서 바다를 바라보는? ?   5 일 이 더 재미있는 것으로.....  뇌우 도 끝내줍니다!  Rav & 리사",5.0
놀라운,"남편과 저는 총 5박 6일 iru sun siyam 푸시 했고 매우 행복합니다.   공항에 도착한 순간부터 남자가 우리를 잡기, 라운지에 있는 직원들의 서비스, 편안한 라운지, 효율성 및 소개를 들고 수상 비행기는 섬, 체크 인 및 우리의 방에 할당된 전체 숙박 시설, 친절한 직원들의 웃는 얼굴이 굉장한 환대와 함께 섬이 유익한 정보 기술의 편의시설, 우리의 숙박 아리마를 단어: 놀라운.   섬은 아주 아름답습니다. It의 맑은 바닷물 과 아름다운 일몰, 같은 좋은 곳인 로맨스! 하지만, 그래도 패밀리의 아이들 때문에 적합한 서비스.   우리의 첫 번째 선택한 오버 워터 빌라는 몰디브에 대한 자체 스파 욕조 및 실망하지 않았습니다. 바로 우리의 갑판에서 사다리를 타고 물 속으로 접근과, 깨끗한 물에 몇 시간 동안 스노클링에. 작지만 훌륭한 특권 에 워터 빌라.   음식. 제 남편과 저는 둘 다 채식주의자 들 은 회의적입니다 수 있는 고 우리의 감자 튀김 피자를 먹고 앞섰습니다. 첫 번째는 다양한 뷔페식 아침 식사는 웃음과 함께 iru. 정말이지 놀라운 선택일 수가 없었고.  레스토랑에서 식사를 할 수 있는 세 가지 다른 것은 그에 대한 많은 채식 메뉴가 따로 전체의 차이.   한가지 선택에 필요한 것을 개선한다면, 레크레이션 활동 축제같은 것이 있는데 탁구 는 더 나은 일. 같은 보수 공사 중입니다.   전반적으로, 모든 것이 놀라운 저는 아주 훌륭해요.   꼭 다시 이용하고 싶은 호텔을 추천합니다! ",5.0
최고의 휴가!!,"저는 몇 가지 부정적인 리뷰를 읽어 보면서 때 iru fushi siyam 의 후기가 sun 에 대한 불안. 그러나 말 이 나는 일 드는 5 8과 9의 두 아이들과 리조트, 지루한 적이 없 이 있었고, 우리는 바쁜 시간 들, 그 가 최고의 여행이었어요! ! 방은 항상 깨끗하고, 하루에 두 번 청소, 전체 리조트는 참 깨끗한. 무료로 제공되는 것을 알고 돈을 내야. 일부 무료 수상 스포츠 키즈 클럽 은 무료로 어떤 음식점 에서 먹고 아이들이 먹고. 여행사 에 대해서 저를 조언 이 되지 않습니다. 직원들은 매우 도움이 웨이터 직원들이 있는 정원에서. 반드시 예약을 할 수 있는 남성을, 또는 이 포함되어 있는 것을 몇몇 사람들이 불평하는 패키지 비용 절감, 수상 비행기 에서 있습니다.  몰디브에 간다면, 이 호텔에 가서! ! !",5.0
최고의 경험,"저는 이 리조트에 신혼여행으로 최고의 경험을 가장 기념관 내 인생에서, 직원들은 매우 친절하며, 좋은 빌라는 숨 막힐 정도였습니다.  저는 다시 방문 할 생각이 오.",5.0
전반적으로 즐거운 숙박,"하지만 우리는 몇 가지 정도 뉴질랜드를 비치 리조트, 이것이 우리의 첫 번째 몰디브 여행. 우리는 이곳에서 5일 밤을.   Sun siyam 비교적 거대한 리조트, 객실이 몇 백. 우리가 예약한 비치 빌라, 디럭스 비치 빌라 로 업그레이드할 수 있지만, 외부는 카바나 해변을 따라 의자가 추가로 에 있다.   찾아 가는 방법:  약 1시간 이 작업에는 수상 비행기 에서 몰디브 송, 비용을 절감할 수 있는 약 500 USD. 날씨가 안 좋기 때문에, 우리는 velaa private 할 시에 한 시간 전에 마지막으로 할 수 있는 선까지 siyam.   해변:  파우더 모래, 맑고 푸른 바다, 해변과 물고기가 있다. 산호초는 괜찮은, 확실히 더 좋은 것 들 이 있다. 산호초가 해변에서 조금 더 해, 더욱 편리한 액세스를 통해 사다리 끝에 있는 워터 빌라.  하지만 리조트는 전체가 도착했을 때, 충분한 공간이 있었고 항상 비치.   빌라:  우리의 비치 빌라는 매우 넓고 넉넉한 크기, 천장은 높았고 큰 야외 에 있는 화장실. 혹시라도 에 큰 욕실과, 실내 및 야외 샤워실, 욕조는 물론 hydrospa. 하지만 방은 최신 알 수 없는 한, 모든 것이 매우 잘 되어 있습니다, 가정부가 한 일을 한 것은 한 빌라 아주 깨끗하고 했습니다.  구명조끼는 빌라에 물을 필요로 할 때 활동이 있어야만 저장할 수 있습니다. 이러한 새로운 아주 lifevests 의 질은 좋았습니다.  매트리스도 괜찮은, 작지만 편안한 만큼 saggy. 뜨거운 물은 간혹 개선합니다 샤워를 하는 것을 아주 뜨거운, 특히 샤워를 할 경우",4.0
결혼 기념일 ,"우리는 7 일 (4일간 3박 디럭스 워터 빌라 비치 빌라 의 수영장) 18 시까지 sun siyam 에서 2015년 8월 25일. 완벽한 리조트인 날씨 였다. 체크인을 할 때 우리는 우리가 묵는 동안 우리 집사 bhuwan 환대를 해 주었는데, 그는 친절한 분이 우리를 특별하게 wasvery, 그는 우리가 머무는 동안 필요한 모든 문제를 해결해. 레크리에이션 센터에서 그는 아주 친절한 시르, 가이드 스노클링과 선셋 돌핀 크루즈 도 해 보세요♪. 집사람 이 한 드라이버 nasirrudeen 하지 않고, 그는 손님들과 함께 웃는 게 너무나 사용함. 전체적으로 우리는 멋진 휴가 이 한 보물 같은 것을 매 순간 모든 직원들이 훌륭한 서비스에 감사를 받은 휴가. 마지막으로 제가 추천하는 워터 빌라는 커플.",5.0
환상적인 몰디브 리조트,"이것이 우리의 두 번째 몰디브 여행이 이 리조트는 올해 에 하기로 했습니다. 조금 후에 트랙을 필요는 수상 비행기가 밤 비행기 의 리조트. 그러나 한 번은 우리가 알게되었다. 일반적인 몰디브의 이야기, 아름다운 섬과 파란 바다와 하얀 모래 사장.  이 리조트에서 우리를 제외한 다른 방식으로 우리를 감동 으로 프라이빗 풀 빌라, 두 개의 큰 수영장도 있었는데, 하나는 성인 들 번만을 위한. 활동도 많은 아이들이 섬에 있는 작은 것들이 리조트를 추천 할 것이 있다면.  저희는 좋은 시간.",4.0
평균,"완벽한 여행이었고, 한 가운데에는 작은 후회 지원하지만, 전에는 친구들을 추천합니다. 저는 여기 풍경, 가장 따뜻한 곳에 다시 옵니다.      ",4.0
지금까지 최고의 휴가!,"그는 2일 전에 다시 와서 열심히 파라다이스를 꿈꾸 답변하기! 전체적인 경험한 것은 후회하는 점은 우리가 독특하고 나는 7박을 예약했는데 만. 저희는 멋진 신혼 여행! 먼저 한 풀장이 있는 비치 빌라로 업그레이드 되었고, 환상적이었습니다. 저는 완전 추천 풀 빌라, 몇 개 없지만 모두 볼 수 있습니다. 다행히도 우리는 정말 완벽한 곳! 우리는 맛있는 음료 및 차가운 수건과 함께 따뜻하게 환영하는 바에서 체크인 했다. 얼마나 멋진! 샴페인과 작은 방이 너무 맘에 들 었구요 웨이퍼로레싱의 비치 백 제공. 방은 완벽한, 샤워와 3( 옆에 있는 수영장과 2 세미 오픈 욕실) 및 자쿠지가 있습니다. 유일한 단점은 욕실은 보통 이 불쾌한 냄새가 있었고, 여러 가지인 뜨거운 물론 극다적인 산책. 하는 것이 더 나은 경우 분리된 객실 내 욕실이 마련되어 있습니다. 바다 전망이 좋은 정자 를 알 수 있었습니다! 거짓말 할 수 있는 몇 시간 동안, 심지어 자고. 이제, 청결함이 뭐라고 해야 할까? 방은 흠 하나 없고 전체적인 분위기 만 볼 수 있는 사람들이 하루 종일 청소 다. 방은 하루에 2번 청소 해 주었고 시설도 풍부한. 칫솔, 치약, 매니큐어 킷트는, 여성 킷트는, 면도, 딸고 (thalgo) 샴푸와 샤워젤, 헤어 드라이기, 모기 장치, 타월이 충분히 있... 열심히 일해 온 젊은 소년은 완벽하게 우리 방은 매일 청소 niyaz. 우리의 풀은 매일 청소 한다, 안 한다, 하지만 그에게 전화를 했을 때, 직원이 와서 해당 를즉시. 섬에 모기도 없어서 훈증 이루어진다. 모든 것이 좋은 레스토랑에서 맛있는",5.0
멋지 honeymoom,"전반적으로, 좋은 경험이었다. 직원들은 매우 정중하고, 친절하고 도움이 필요한 모든 것이 될 수 있습니다. 아름다운 섬은, 좋은 장소가 준비되어 있는 편안한 휴가 - 우리는 이 곳에서 신혼여행으로. 우리는 해변의 빌라에서 묵었는데 - 방은 좋았습니다, 말이 되지 않고 있는 것을 알 수 있다 몇 년째 개장 또는 通電. 본 마모 및 외관 손상 에 시작할 수 있습니다. 마음에 드는 야외 욕실, 그리고 세면 도구가 매일 채워졌다. 방은 깨끗하고 좋았어요. 음식과 음료도 환상적이었습니다! 모든 것이 다 맛있는, 한 종류의 다른 요리도 있고. 하지만, 매우 비싼 편이었습니다. 우리가 기대했던 것에 비싼 편, 시의 중심부에 아무데도 없다. 그러나, 우리는 여전히 작은 충격에 드는 비용 - 그 준비를. (실제로 해 저렴한 가격에 주문한 저녁 식사 레스토랑 중 한 곳에서 먹는 것보다 방.) 수영장이 있는 행복한 시간을 반사, 아름다운 일몰. 뷔페식 아침 식사는 놀라운, 매일 아침 식사를 할 수 있는 꿈의 음식. 우리는 큰 아침 식사를 먹고, 점심을 생략하는 것이 필요하지 않았다. 말레에서 수상 비행기 45분 거리에 있는 여행, 아름다운 여행입니다 - 하지만, 이 호텔은 가격에 포함되어 있지 않습니다. 한 사람 당 $500 이 넘을 겁니다. 스파는 훌륭한 휴식, 그리고 자주 사용하는 경우 하루 중 특정 시간에 할인 받을 수 있습니다 (활용할 수 있는, 그 또한 꽤 비싼). 스노클링 장비는 무료로 대여해 주 동안 머무는, 놀라운 물고기와 산호초 섬 주변에서 볼 수 있는 - 좋은 경험이었다. 테니스 코트를",4.0
"우리는 $32,000 걸림편.","나는 리셉션에 앉아 있는 sun siyam 푸시 iru 호텔에 묵었어요. 훌륭한 휴가는 악몽 으로 바뀐 것으로 시작되었다. 궂은 날씨 때문에, 비행기 시간은 17:00 종료 시에 푸시 오늘 iru. 우리가 이야기 하고 모든 가난한 날씨 때문에 이용할 수는 없는 섬 여행 계획을 알터네이트. 이 순간의. 내 가족과 나는 몰디브에 있는 $12,000 $30,000 사이에 붙어있다 하지 않고 집을. 한 가지 방법, 5 사람들을 위한. 호텔, ""sun siyam 푸시 iru"" 에는 충분한 기회를 우리에게 알린 낮에 날씨가 변경 및 전송 male 공항. 대신, 그들은 너무 늦은 시각까지 기다리는 내일을 웅형 때까지 수 없습니다. 에미리트 항공 비행기가 우리까지 8월 24일 더 이상 사용할 수 있는, 따라서 우리는 새로운 항공사 티켓을 새 없이 비용을 최대한의 원래 티켓, 비용 (인력의 5), $14,000. 호텔 로비에 앉아 있는 저는 전화상으로 항공사에서는 볼 수 없는 결론적으로 3시간 이상 trunkh 수 있습니다. 가격이 터무니 없이 비싼 동안, sun siyam 푸시 iru 이동 없이는 모든 지원이 문제도 우리에게 우리가 한 여분의 밤 (s) 에 묵고 있기때문에 부적절함. 아이들은 굶주리고있다 먹을 때까지 우리는 문제를 해결할 수는 없는 항공사, 파괴 해 지쳐 있고. 우리는 다음 몇 가지 일을 하지 않는 방 안에 $350 음식, 및 기타 필수 제외. 없는 깨끗한 옷을 세탁 의 시로 지금 우리가 있는 한 쌍의 속옷 이 $3.00. 저는 모든 사람들이 쓰며 보낼 이를 알이 수 있습니다. 나는 전",1.0
친절한 가족 휴가 리조트,"이에 대한 읽기 및 / 또는 첫 번째 댓글에 가기 전에 iru fushi 받았습니다.  음식은 비쌌지만: true로, 예산 이 점을 고려할 우브드에, 몰디브 하면 많은 음식과 음료를 만드는, 이해할 수 입니다. 나는 수상 교통의 음식을 먹었고, 그처럼 즐기는 격리 고려해야 합니다 개인 섬에 위치한 깨끗한 바다가.  저는 이 섬은 섬 전체가 이 한 박쥐 라 고. 작은 생물 을 안 한 가난한 게 인간의 길을 즐기는 모습을. 가끔 들릴 수 있는 경우 꺼칠 꺼칠 주의깊게 볼 도마뱀이 잎에 여전히 수 있으므로, 보다 깊이 및 빠른 식물. 인간 도 바로 이 혼자 떠남 에 박쥐 (bindlestiff 과일 박쥐, 사고는 있지만 사진 촬영 후 바로 깨닫는 처음 하는 박쥐가 우리 위에: 귀중한!    Iru fushi 에 해당되는 것은 처음으로 분기 리조트 허니문 리조트 패밀리 비즈니스. 몇 가지 이유를 설명할 수 있는 이 방에 있어서 아이들과 함께 상위 몇 가지. 이 호텔의 잘못이 아니, 더 많은 문제를 여행 사실, 우리는 주어진 모든 정보가 있었지만, 우리는 할 수 없는 풀 빌라 비치 디럭스 디럭스 빌라 가 아니었다. 또한 설계할 수 있는 이상한 특이 체질 빌라, 야외 샤워 시설이 있는 모래 에 소금을 없애고 적절한 목욕, 있지만 이 단계를 건너 새워는 전체 방은 욕실 테라스, 이상한!   하지만, 가장 중요한 것. 그 스트레스가 얼마나 좋은 여행 했습니다. 호텔 직원들은 매우 친절하고, 최고의 서비스를 제공해 시도 할 수 있다. 후세인 씨 의 빌라 요금의 문지기 의 아름다운 조각과 수건을 꼭다발과.",4.0
내 꿈 에서 처럼,"아름답고 완벽한 신혼여행. 우수한 스노클링 에 있는 섬. 가장 친절한 직원들, 제가 만난. 높은 가격 수준 (몰디브 같은 나머지 및 여러 사람들이 다.",4.0
아름답지만 비싼 음식,좋은 위치와 시설. 엄청 비싼 음식 이지만 아주 친절한 직원들. 그렇지 않으면 모든 포함 거래 작성하시면 두 번 합니다. 어른 2 아이 2이 400 $$ 에 한 저녁 식사,4.0
단순히 놀라운,첫 번째 몰디브 여행. 정말 놀라운. 비치 방갈로에서 묵었는데; 마지막 3일 밤을 지낸 워터 빌라. 환경 amaxing. 워터 빌라는 거실 등 최고의 아쿠아리움 - 하고 바로바로 수영하고 다이빙 하죠 // 아주 수족관!,5.0
사랑스러운 휴일,"일광욕 siyam 푸시 iru, 아름다운 리조트, 7월 11일에 나는 가족과 함께 stayede. 정말 아름다운 리조트, 빌라는 아주 크고 깨끗하고 좋습니다. 우리는 해변의 빌라에서 8일 밤을 stayede 제 3박을 할 수 있는 디럭스 룸과 그 풀이, 하는 것은.   이 리조트는 매우 좋은 아이들이 특히 kidsclub 마르티네스 는 환상적입니다. 여자들이 하는 일이기 때문에 매우 신 kidsclub.  스파는 환상적이고 매우 좋은 스웨덴 식 마사지, 60분 비용과 세금 및 서비스 요금 비싸긴 하지만 125 $154 $, 마사지 1만 이 휴일 이 기 때문에, 나는 다른 처리할 때는 일반적으로 ' 휴가 입니다.  이는 매우 비싼 호텔, 이것때문에 원격 섬상의, 작은 집에서 만든 아이스 크림 이지만 5 $8 $spone 의 커피 한 잔을 한 수 없는.  아침 식사도 뷔페식 레스토랑이 있는 지루 iru. 다른 호텔에서 묵었는데 아침 식사가 호텔에서 환상적인 몰디브, 함께 nutsstation 과일과 채소, 과일을 한 것은 가지고 할 수 있는 중에서 선택할 수 있습니다. 하프 보드는 어느 dinearound, 그리고 은, 우리의 맛도 즐겨 찾기, 프렌치 레스토랑. 뷔페 레스토랑 이는 악몽 iru, 저녁 식사를 2 번만 있었기 때문에, 무서운 꿈 이었고, 때문에 너무 많은 소음이 있을 뿐만 아니라  사람들.  저녁 식사는 아주 좋은 곳은 전용.  이 티켓을 예약하기 전에 반드시 알아야 할 수 있는 이 아름다운 리조트에 있는 홀리데이 인 사람들. 저는 그 중 많은 무례한 행동에 대해 잘 되지 않고",4.0
좋은 훌륭한 건 아니었지만,"이 화려한 섬, 몰디브 여행을 즐길 수 있는. 우리가 묵었던 워터 빌라를 추천한다 622 중 최고의 보호 및 액세스를 위한 가까운 아주 좋은 하우스 리프는 없지만 괜찮아요. 멋진 음식 옵션도 같은 곳에 몰디브 최고의, 레스토랑과 카페들이 보다 더 좋은 걸 주는 뷔페 저녁 식사. 하지만, 멋진 뷔페식 아침 식사는, 어려운 어떻게 이런 개선. 하프 보드를 제공하지 않는다, 그냥 침대와 아침 식사가 다른 식사할 돈을 이같은 비용 있는 여러 옵션 중에서 선택할 수 있습니다. 아이스크림 바 해 밀크 셰이크 가 없는 모든 일은 불가능합니다. 음식 비용은 매우 높은 사람들이 말한 것 같은, 일반적인 객실 비용보다 낮지만 티형 있어 매우 높은 방의 질. 비행기를 타고 오는 단순히 가격이 $500 rt 침종식... 하는 멋진 전망의 좋은 곳입니다.  모든 면에서 서비스가 훌륭한, 친절하고 매우 편안하고 즐거운 항상 그가 무엇을. 많은 활동... 나는 너무 많은 몰디브 섬에 생각보다 더 많은 제트 스키 이용해야 하고요. 또한, 이 섬 들 은 이해하는 일이고 스노클링 하기에 좋습니다. 하우스 리프는 거의 평균, 스노클러와 미터가 경험이 풍부한 겁니다. 시드니 최고의 스노클링을 하지 않는 여행할 가치가 있는 일들을 위해 비용을 $104 물은 다른 뭔가를 볼 수 있습니다. 그냥 즐겁게 하는 한, 이 또한 이해하지만 주로 가족 리조트... 많은 아이들이 있을 것이다. 정말 좋은 아이들을 위한 활동. 무료 스노클링 장비와 전동 투사 된 스포츠 중에 인색하게 하는 것 같은 느낌이 들지. 두 개의 수영장은 좋은 단순한",4.0
사소한 데 신경을 가진 우수한 경험,"장점:  - 놀라운 직원 (dorothy 케냐 에서 오는 모하메드 및 감사 드립니다; 나시 방글라데시 에서 ""엄마"" 및 아이들이 클럽), 특별한 이상이 한 사람들이 장소 자체 내 기대 이상) - 환상적인 섬, 천국, 하나님의 걸작 - 다양한 해양 스포츠를 - 여러 식당들에 비해 - 큰 이동에 어느 섬에서, 버기 (골프 카트) 하여 걸어갈 수 있는 자전거를 대여 해 주었으면 좋겠다는 - 무료 생수는 방에서, 한 때 큰 차이는 하루 종일 물을 마시는 스노클링 장비를 이용하여 - 았다는 전체 숙박, 리조트들 일일 요금  단점:   - 너무 많은 편의 시설 및 레스토랑 공사 중 (을 물어보는 것을 예약하기 전 어떤 작업) - 엉망인 인터넷에, 많은 수 있으며 이러한 속도 (필요할 경우 좋은 인터넷 비가 하루 종일) - 객실 내 영화는 비싸지만, 15달러 영화 레스토랑은 매우 비싼 편이지만 아이들이 먹고 있어서 무료로 사용하기 위한 - 아이들이 있다면, 그렇  전체적으로 하는 것을 추천해 드리고 있습니다",5.0
괜찮은 곳이지만 음식에 실망 해,우리는 이곳에서 6월 말에 멋진 휴가였다. 이 두가지 단점만 음식과 수상 비행기. 제 아내는 채식주의자 및 옵션이 매우 제한된. 다른 사람들이라고 느끼는 전용 시장이 강제로 먹을 수 있을 때. 수영장 바 및 레스토랑에 가까운 18:00 19: 00 오픈. 거의 패키지에 대한 최소 비용이 $100 때마다 다음 방문할 식당.  하나의 섬을 수상 비행기가 있는 땅 이 아주 시끄러운 특정 시간에 동시에 2개 또는 3개의 평면.  다이빙 센터는 다이빙 사이트 근처에 수 많은 훌륭한 팀과 함께 실행할 수 있습니다.,4.0
순수한 천국,"이 섬은 놀라운 - 순수한 천국. 우리의 결혼 기념일을 축하해 저희는 이곳에 오는 모든 것들이 제 2의 1st. 물이 맑고 모래 가루 같은 느낌 - 같은 것은 본 적이 없었는데! 사진은 정의하지 않는다, 볼 수 없는 것이야.  직원들은 매우 친절하고 도움이 되었습니다. 집사가 아주 특별한 손님을 sayyah 주. 그는 우리에게 그는 아무것도 할 수 없습니다 이 항상 미소 짓는 그의 얼굴.  수상 비행기로 45분 거리에 있는 섬에 도착했다. 비싸지만 그만한 가치가 있는 수상 비행기로 이동. 전망은 평생에 한 번은 경험이었습니다.  약 50분 정도 걸리는 꽤 큰 섬을 걸어가다. 레스토랑은 다양한 종류의 세계 각국의 음식과 약 7 3 바. 모든 것이 비싼 편이지만 기대에 섬에서 섬의 중심부에 있는 인도의 바다! 아무 것도 없는 섬에서 성장, 이 두 배 또는 8 시간이 걸리는 비행을 가능하게 - 수 시간 및 비용에 감사하고 신선한 음식들 의 세계. 풀 보드 패키지 요금은 저희는 술이 최고. 패키지에 포함되어 있는 레스토랑 iru, 그러나 다른 레스토랑에서 식사를 하는 경우 신용 의 정도는 $60. 위로 가면 한 신용 카드 지불하더군요. 물 한 병에 $5달러는 약 $11 부터 시작해서 우리는 칵테일과 음식이 맛있는 음식점.. 메인 바에는 밤에 라이브 엔터테인먼트, 음악가, 댄서, dj 등이 있다.  우리는 해변의 빌라는 아주 넓었고, 전용 및 멋진 해변에서 멀리 떨어져 있는 몇 가지 단계. 야외 욕실은 넓은 자쿠지와 개인 보다 더 많은 돈이 아깝지 않은 워터 빌라.   선셋 돌핀 크루즈를 추천합니다",5.0
지상 낙원,"정말 최고의 장소입니다. 그만한 가치가 있다. 가장 좋은 위치 친절한 직원들. 이 모든 것들이 날. 유일한 단점은 음식, 괜찮았어요. 그래도 추천합니다, 평생에 한 번 볼 수 있는 환경.",5.0
가격 대비 품질 옳지 않다 …,"사실 입니다. 이 작은 섬인 파라다이스의 에메랄드 바다에 둘러싸여 있는 트로피컬 정말 축복 입니다. 한편, 이 섬에서 할 때 ' 캡처된 게스트 ': 이 섬에 있는 호텔, 식당 등에 관계 없이 없습니다. 하지만 음식 가격 / 품질 비율을 실체법이 부족했다: 비싼 가격, 서비스의 일관성 - 가끔은 평범했지만 사용하면 보통 수준 이 우수한, 일관성 및 식사의 질 또한. 또한 가난한 제품 지식 (한 샐러드와 염소 치즈 를 제공 로크포로, 요리사가 저를 설득하는 데 염소 치즈. 예를 들어). 여자 아이들의 ' 클럽도 좋고, 깨끗하지만 모든 이는 ' 아이들이 ' 파크 ' - 그들은 더 많은 것을 할 수 있는. 전반적으로, 정말 좋은 추억이 있는 이 곳, 할 수 있지만 완벽하지 않은. 조금만 주의 할 것은 엄청난 차이.",4.0
좋은 선택,좋은  할 말이 없는 시설의 。 더 ， 수  。 。 。 。 。 。 。 。 。 。 。 。 。 。 。 。 。 。 。 。 。 。 。 。 。 。 。 。 。 。 。 。 。 。 。 。 。 。 。 。 。 。 。 。 。 。 。 。 。 。 。 。 。 。 。 。 。 。 。 。 。 。 。 。 。 。 。 。 。 。 。 。 。 。 。 。 。 。 。 。 。 。 。 。 。 。 。 。 。 。 。 。 。 。 。 。 。 。 。 。 。 。 。 。 。 。 。 。 。 。 。 。 。 。 。 。 。 。 。 。 。 。 。 。 。 。 。 。 。 。 。 。 。 。 。 。 。 。 。 。 。 。 。 。 。 。 。 。 。 。 。 。 。 。 。 。 。 。 。 。 。 。 。,4.0
