Title,Detail,Rating
파라다이스,"이 어린 두 아이들과 우리의 첫 번째 몰디브에서 내가 운이 좋아서 그 일은 우리의 휴가 목적지 선택 siyam. 우리는 모든 것이 완벽하게 갖춰져 있는 수상 방갈로를 5일. 방에서 보이는 전망이 아름다운 우리에 대한 요청을 하는 사미르 부틀러. 아이들이 좋아하는 스포츠 센터. 직원들은 바나나 보트, 재미있는 튜브, 윈드 서핑과 카약 도 있었다. 하지만 이미 가입 돌고래 크루즈와 스노클링 여행 운이 좋습니다. 아주 잘 배치되어 있다. 전체적으로 우리는 멋진 시간이었습니다. 우리는 꼭 다시 올 것이 처음으로 선택한 몰디브 sun siyam! ",5.0
진정한 환대와 휴식,"제 아내와 저는 개인 수영장이 딸린 비치빌라에 중에 행복한 일 관리구.  우리의 숙박을 했습니다. 빌라는 넓은 욕실이 있는 일광욕 실 및 레인 샤워기가 있었습니다. 무성한 수풀 이 열면 아름다운 경치에 둘러싸여 있는 호수의 해변. 침대는 편안했고 청소 서비스는 훌륭했습니다. 도착해 수상한 아슈 파크에 도착했을 때 우리가 머무는 동안 우리에게 데리고 갔습니다. 모든 직원들은 친절하고 효율적. 이 섬은 아름답고 잘 관리; 나무와 아름다운 식물. 음식이 맛있는 경우는 다소 비싼 편. 아침 식사 뷔페는 신선한 주스 등 많은 종류의 완벽한 건강 및 로컬 카레. 하던 두 명과 시끄러운 이웃들 은 그들의 아이들의 비명 지를 만큼 이루어 사려 아슈 파크 팀 문제 해결을 지원하기 위해 최선을 다했습니다. 전반적으로, 평화로운 섬인.",5.0
"좋은 위치, 멋진 리조트, 시설과 친절한 직원들이 위치해 있어서","위치도 아주 좋았습니다, 성숙한 나무 그늘 사이 바닷가 별장 정원과 함께 자리 잡고 있기 때문에 이 곳에 묵었는데 워터 빌라 다. 우리는 할 수 있는 장점이 있기 때문에 어느 하다. 다음과 같은 경우에 있어서 화이트 샌드 비치에서 수영을 하면서 밖을 크리스탈 색 바다 비치 빌라를 예약하는 것. 반면에 워터 빌라가 바다로 직접 수영 및 스노클링을 더 베란다. 두가지 모두 수준 높고 편안하게 꾸며져 있. 동봉 된 전용 안뜰 과 데이 베드가 비치 빌라, 야외 샤워 시설, 자쿠지 욕조와 실내 샤우어기. 오른쪽의 주위에 섬 전체를 걸어서 갈 수 있는 만족 흰색 모래 해변에서 운동을 한 시간. 보트를 타고 스노클링 여행을 했고 리조트는 훌륭하고 수중 생활 이었다. 일요일, 다이빙 강사 이 특히 도움이 되고, 친절하고 유익한 정보. 여행의 또 다른 하이라이트 카운티까지 이 섬은 휴일이었습니다. 근처에 앉아 창문을 볼 수 있는 가는 길에 볼 수 있기 때문에 그냥 지나치면 섬과 산호 라군.  레스토랑은 비싸고 몰디브 아일랜드 리조트의 일반적인 리조트. 부분적으로 있기 때문에 비용이 될 수 있는 수송 원격, 높은 음식과 음료를 할 수 있습니다. 음식은 뷔페식 아침 식사는 객실 요금에 포함된 수준 높은. 모든 항목을 포함하는 패키지는 믿을 수 있는 값에 대해 사용할 수 없습니다.",5.0
모든 직원들이 훌륭한 서비스를 제공하는 빌라,"신혼여행으로 방문한 곳이었고 직원들의 서비스가 제공되는 리조트에 실망 하지 않습니다.   나는 특별한 언급은 이용하여 부틀러 하디 타우브 -- 그는 우리가 편안하게 머물 수 있도록 해 내려 해서 타고 공항으로 가기. 그는 우리가 얻을 수 있도록 최고의 명소는 모든 레스토랑. 그는 신속하고, 예의 바르고 정중 한.  대나무 -- 아, 인도 레스토랑! 인상적인 맛있는 음식, 친절한 직원들은 매우 따뜻하고 친절한 매니저! 안에 레스토랑입니다. 가치 있고!   다음에도 꼭 이곳에 다시 묵고 싶습니다. ",5.0
좋은 리조트,"환상적인 리조트 시설도 훌륭합니다. Water villa는 스노클링 오른쪽 아래 수 있습니다. 너무 너무 좋은 비치 빌라, 수영장에서 몇 단계로 비치. 아주 아름다운. 아일랜드 그릴 레스토랑도 훌륭합니다. 이 멋진 서비스. 신혼여행 커플 새로운 것이 좋습니다. 잊을 수 없는 로맨틱한 여행이 될 수.",5.0
훌륭한 리조트에 훌륭한 서비스 &,"우리는 최근에 선을 탐험 합니다 전체적으로 좋은 리조트 siyam 을 푸시 iru 휴가. 이 섬은 거대 하 게 크고 멋진 해변 액세스할 수 있습니다. 우리는 수영장이 딸린 디럭스 비치 빌라는 해변은 우리 빌라에서 몇 걸음. 특히 섬의 주민의 음식인 그릴, 많은 다양한 종류의 특선 요리를 맛보실 수 있는 레스토랑 & 바 음식으로 14. 있다면 긴급 요청, 영업 활용 방안 및 을 수가 근처에 몇 분 정도. 전반적으로 매우 효율적인 팀. 감사 ananstasia, sales manager 및 sun siyam 따뜻하게 환영해 우리 호스팅. 곧 다시 가고 싶어!",5.0
멋진 휴가,나는 이 곳에서 4일 밤을 나의 가족 (아내와 젊은 차일 2). 수영장이 있는 비치 빌라를 예약하는 완전히 개인 풀. 모든 것이 완벽한 직원들은 협조적이었고 (우리 집사 adheeb 감사). 키즈 클럽 은 모든 일을 재미 있었어요. 다양한 종류의 음식이 있지만 상대적으로 비싼 옵션입니다. 추천 대상.,5.0
지금 우리의 최고의 신혼여행! ,"이 리조트의 최고는 최고의 신혼 여행지! 직원들은 친절하게 우리의 신혼여행을 잊을 수 없는. Jaweed, 우리의 개인 부틀러, 우리가 받을 수 있. 호라이즌 빌라는 놀랄만큼 아름다운 일몰. 개인 자쿠지, 스노클링 지역 바로 아래 우리 빌라, 주변도 훌륭하다.  더 오래 머물 수 있다. 커플과 가족들이 이 곳을 추천.   언젠가 다시 갈 수 있길 바랍니다! ",5.0
멋진 경험,"신혼여행으로 간, 마법 같은 대부분의 시간을 완벽하게 같은 느낌의 사진을 찍고 동영상 또는 들어가 있었습니다. 친절한 직원들, 특히나 우리 부틀러 할당된 자릴, 그는 항상 우리의 필요로 하는 언제나 진지한 미소 (종종 궁금해 보자, 그는 항상 사용 가능). 할 수 있는 다양한 뷔페식 아침 식사는 약간의 음식을 먹어본 최고의 리조트 호텔. 시 한 수의 요금을 내야 지원하지만 (제가 생각하는 공정한) 것이 가치가 있습니다.",5.0
"놀라운 휴가, 최고의 장소 이 다!","우리는 우리의 아이들은 3 가족 여행 정보 공유 경험을 기대하고 있었다. 놀라운 휴가!   Iru fushi 에 sun siyam 가족과 함께 휴가를 7월 말. 우리가 결정한 여행이기 때문에 많은 시간을 투자 계획 해야 한다. 운이 좋게도 한 록산느 는 최고의 선택이라고 해서 우리의 위대한 여행사 직원에게 추천 에서 다시 한 번 여행을 록산느 는 수행할 sun siyam 모하메드 이브라힘 과 그 ausath 및 등 모든 직원들이 거기서 hathim, 우리 방은 깨끗하고 직원들도 훌륭한 모하메드 등: hisham, hassan, 기타 여러 ausath 제가 기억 할 수 없습니다. 사람들은 훌륭한 일 에 감사 드립니다.  잘 했어요.  우리는 수영장이 딸린 비치빌라에 에 멋진 디럭스 룸 였습니다. 오픈 에어 화장실, 카바나, 커다란 침대. 모든 빌라는 아름다운.  레스토랑. 아 세상에 … 뭐라고 해야 할까? 제가 생각하는 6주 kilos! 부끄러운 줄 알: d 우리가 제일 좋아하는 레스토랑은 이탈리아어 이 내려다 보이는. 전체적으로 음식은 아주 좋았습니다! 트리오가 위로 맛, 맛있 iru 에 또한 훌륭했습니다.  우리 들도 활동 한 웅장한! 스노클링 장비와 오리발을 무료로, 이 제트스키, 다이빙을 하는 사람들은 학교에서.  우릴 잊을 수 없어 환상적인 스파, 아름다운 달콤한 여자 의 트리트먼트 룸 과 수행할 수 있습니다.  나는 무엇을 할 수 있겠어요? 이는 후에 뭘, iru fushi 로 sun siyam!   다시 좋은 서비스와 환대에 감사, 감사하게 생각한 그 이상을 하고 있는지 우리는",5.0
'천국' 이 지구상에,"Sun siyam 제가 지난 주는 단순히 뛰어난 푸시 몰디브 iru! 럭셔리 비치 빌라에서 나는 살았다. 방은 넓고, 넓은 정원 밖에 카바나, 테이블 및 의자를 직접 바다! 빌라에는 야외 샤워 하기, 자쿠지♥, 그리고 욕실이 마련되어 있습니다. 빌라는 세련된, 넓고 매우 편안했어요. 에티하드항공 과 함께 한 하프 보드 패키지를 예약했는데. 비행기에서 1시간 지연되는 아부 다비, 수상 비행기 놓칠 것을 걱정하는 내에서 이루 푸쉬 하는 남자! 에티 하드 가 처리 다 멋지고! 저희가 말레 공항에 도착, 호텔 라운지의 안내를 시작하고, 휴식 할 수 있는, 먹고 마시는 무료로 제공되는 간식, 차갑고 따뜻한 음료. 마지막으로 우리의 수상 비행기에 실어, 45분 비행기 였어요! 우리는 우리 직원들이 환대해 주었고 파리에 푸시 iru 잘릴 개인 부틀러. 그는 놀라운! 낮에 충전 하면 부틀러! 당신의 저녁 식사 예약 / 점심, 스노클링, 모든 여행을!  장점 -- 친절한 직원, 거대한 뷔페식 아침 식사. 아침 식사를 제공하는 아이스크림 특화정보에! 하하하 . 하고 게으른 아침, 일어나 보니 나는 매일 아침 식사를 잡아! 아름다운 바다, 신혼여행 꿈의 위치, 또한 가족 아이들과 함께! 많은 활동 이다. 사랑스러운 레스토랑, 좋은 음식, 깨끗한 해변. 버기 서비스 수 있어. 마음에 드는 레스토랑은 맛! 태국 음식도 정말 죽재! 직원은 친절하고 도움이 되었습니다. 우리가 원하는 모든 곳에서 식사를 했는데 음식과 글루텐 권장, 인식이 들! 이 사실을 보여줍니다. 방은 하루에 두 번 청소를 해, 물 보관, 베드",4.0
완벽한 가족이 아이들과,"우리는 이 리조트에서 10 밤, 우리는 이곳에 2,5 및 7 년. 큰 아이들, 여성들이 도 아주 친절했습니다. 구축함 이 시간이 지나도 아주 훌륭합니다. 방은 매우 넓고 깨끗했고, 직원들은 매우 친절하고 도움이 되는 멋진. 우리는 다이빙 센터를 사용하지 않은 그곳에 묵는 동안 날씨가 좋지 않았다. 하지만 아주 비싼 편.",5.0
저렴한 상품,"멋진 시간을 보내서 iru 푸시 siyam! 이는 4번째 몰디브를, 하지만 나는 나를 보지 못했다는 것이 지금까지 이렇게 아름다운 섬. 도착했을 때, 불행하게도, 저희는 날씨가 되지 않은 최고의 비치 빌라 (한 사람의 오른쪽에 섬에서 한 점 정도 요) 이 모두 좋았습니다. 날씨가 확실히 도움이되지 않았다, 바다와 가깝지만 방은 아무데도 없다 (등을 할 수 있는 볼이 있었고 다른 방 앞에 있는 방갈로). 방은, 하지만, 욕실이 아주 좋고 정말 아름다운 꽃이. 우리는 방을 바꿔 달라고 한 매우 아름다운 워터 빌라 (특히 마지막). 방은 매우 아름답다, 아름다운 풍경이다. 내 생각에 최고의 워터 빌라 타입의 룸이 기 때문에 이렇게 훌륭한 스노클링을 하기에 아주 좋은 그가 개인 정보 보호 및. 저는 걸어서 갈 수 있는 섬 전체가 주변에 있는 선셋 워터 빌라 비치 빌라 후 발견 (해): 그들은 심플하면서도 우아한 이 섬의 다른 비치 빌라에 위치해 바로 앞에 바다도 있었고 많은 개인 정보 보호 정책 (매혹 적게)! 또한 대부분의 개인 수영장이 있기 때문에. 하지만, 하지만. 추천하지 않아 심각하게 어디 스테이징될 워터 빌라 (폴리네시아 하 제외). 전체적인 매혹적인 시나리오는 보지 못했다는 것이고 전에 이러한 유혹하는 섬 몰디브 (지도와 하기 전에, 이번이 4번째!).  음식은 훌륭합니다! 다양한 뷔페식 아침 식사와 저녁 식사가 이 모두 마음에 들지 않는 하루가 되지 않은 음식! 레스토랑 음식도 맛있고 적극 추천할 수 있는 이 섬의 주민의 뱀부 레스토랑. 저희는 항상 점심에는 수영장에 있는 바에서",5.0
가족 여행을 할 수,"가족 여행의 경험에 대해 공유하는 흥분 5 살짜리 아들.  놀라운 휴가!  픽업해서 seeplane 및 라운지 변형대. 하지만 우리는 즐거운 시간을 기다려야 할 시간이: 마사지를 합니다. 45분 정도 걸렸는데 정말 멋진 여행에서 seeplane 에 있는 놀라운 전망을 즐길 수 있는 기회!   호텔 직원들은 우리를 반갑게 맞아 주 깨끗한 수건과 음료를 환영합니다. 우리의 숙박 시설은 우리에게 쉬는 시간을 저녁 식사 전에 준비되어 있었다. 호텔은 편리함을 제공해주는 전기 차.   우리는 훌륭한 솔루션을 이용할 때는 패키지 투어 aii 자. 저는 사실 놀라게 하는 식당이 호텔이 있는 지역의 14 및 베트남 요리를 즐길 수 있어. 우리가 묵었던 워터 빌라는 가족이 아이들과 함께 하기에 적합한 7층에 있는 파노라마에서 y.o.. 우리는 여러 번 여행, 낚시 등 돌핀 크루즈 및 유람선. 마지막으로 그는 물고기를 잡은 우리는 놀라울 정도로 매력적인 남편의 저녁 식사. 좋은 다이빙 센터가 이 호텔에 있는 모든 일을 배운 파도타기 하다! 방금 십니까! 제 남편과 저는 우리 아이들이 있는 일을 하면서 시간을 보내는 아이들이 스포츠 클럽 비디오 게임을 플레이하고 (그의 활동이 가장 마음에 드는 것은 물론))) 한 여러 다른 흥미로운 활동 (미로 보드게임, 수영장) 에 의해 관리된 베이비 시터 착하고 친절했어요.",5.0
완벽한 휴가,"한 일 년 후에, 우리는 4일 대한 sun siyam 펠리클 6 월 말. 우리가 묵었던 디럭스 비치 빌라 앞에 수영장, 온수 욕조 및 개인 뒤에 있습니다. 직원과 서비스도 훌륭하고, 물이 따뜻하고 깨끗한 해변. 분명히, 당신이 외딴 섬이 기 때문에 음식과 음료 가격 반영하는... 더 높은 가격의 와인과 음식을 준비하는! 우리가 제일 좋아하는 레스토랑은 이탈리아식 이 내려다 보이는 가장 실망스러운 ""철판구이"". 전체적으로 좋은 것을 기대하지 않은 음식, 뷔페식 아침 식사는 좋지만!",4.0
아름다운 훌륭한 허니문 목적지,"전반적으로: 훌륭한 서비스, 방은 놀라운, 맛있는 음식과 음료는 맛과 품질이 매우 좋아. 스파는 꼭, 직원들은 매우 협조적이고 친절했습니다. 또한 이 리조트는 가족들   제 아내와 저는 이 호텔에서 8일 신혼 여행.  신혼여행의 경우 호텔을 말하는 그들에게 특별한 치료.  말레 공항에 도착했을 때, 우리가 다른 리조트 대표, 그는 우리에게 비교적 작은 공항 가 우리 짐을 체크인 푸시 iru, 수상 비행기로 45분 거리에 있는 한 사람 당 $500 참고하였습니다. rt, 그도 들 어 리조트의 라운지에서 무료로 제공되는 간식 공항 위치를 다시 마사지.  비행기에 내리자 마자, 우리 궁전까지는 갈 수 있는 레스토랑 / 부틀러 jilaal 호텔에 우리에게 모든 것이었습니다.  방을 예약했는데 아침 식사가 포함된 옵션에 대한 것이지만. 모든 항목을 포함하는 경우도 큰 음주자 는 옵션 수 있습니다. 맥주는 $9 15 - 18 $칵테일 사이에 실행됩니다. 요금 일체 포함 음료 무제한 하루 세끼 식사만 포함, 룸 서비스도 없고 미니 바, 각 전채 음식으로 구성, 메인, 디저트를. 뷔페의 가격은 $50만 또는 모든 종류의 술을 마시는 사람도 제외 (하지 않는 모든 항목을 포함하는 모든 것들이 무료). 평균 식사는 약 $30 - $55 레스토랑에서, 일반적인 전채 는 $23, 디저트 $17건   일출을 볼 수 있는 수상 빌라, 전망은 놀라운, 믿을 수 있는, 하얀 가루 같은 해변. 놀라운 서비스, 룸 서비스는 하루에 두 번. 사람들은 매우 친절하고 매일 사용할 수 있는 것처럼 느껴지는 특별한 손님들.  ",5.0
아름다운 충분한 보십시오.,"Sun은 7월에 가족과 함께 휴가를 푸시 siyam iru. 이는 결정이 기 때문에 많은 시간을 투자한 여행을 계획해야 한다. 운 좋게도, 우리는 지금 최고의 선택.  우리는 수영장이 딸린 비치 빌라에 있는 멋진 디럭스 룸이 었습니다. 오픈 에어 화장실, 카바나, 큰 침대에, 작은 사항 몇 가집니다 쿠키는 저녁에... 모든 빌라는 아름다운.  레스토랑. 세상에... 뭐라고 해야 할까? 나는 4 킬로 에 넣어 주는 것 같아요! 이 트리오 가 위로 맛, 맛 또한 훌륭했습니다 iru 더 에서, 다음에 물린 반사... 우리들 도 활동 한 웅장한! 무료 스노클링 장비와 오리발을, 이 제트스키, 다이빙을 하는 사람들은 학교에서.  우릴 잊을 수 없어 환상적인 스파, 아름다운 달콤한 여자의 트리트먼트 룸과 수행할 수 있습니다.   나는 무엇을 할 수 있겠어요? 그냥 앉아 있으면 내 카바나, 내 책을 읽고, 멋진 음식을 먹고, 술을 마시는 동안은 가족과 함께 편안한 시간을 즐기는 쉐이크 와 주스. 이는 후에 뭘, 가서 iru 푸시 siyam!",5.0
동화 같은 대상,"환상적인 아일랜드 리조트, 약 250 sq m, 하얀 산호 모래 해변의 환상적인 열대 나무로 만들어진 것이다. 이 섬은 파라다이스 가 작은 것이라 할 수 있고 잘 조직되어 있는 ' nt 더 부탁드립니다. 우리는 우리의 비치빌라는 깨끗하고 크고 놀라운 두 번이나 야외 욕조가 필요한 모든 것이 있다. 샴푸와 샤워 젤 등의 간단한 작은 것들까지 입을 씻고 몸을 씻고 수세미. 우리는 욕실이 라, 2( open 하나 하나 폐쇄) 로 샤워를 할 수 있는 커다란 침대가 하나 있고 쉬 착탈부의!  다양한 맛이 있는 모든 breafkast 마다 (아이스크림도).  호텔은 많은 레스토랑에서 저녁 식사. 저녁 식사를 했는데 모두 있습니다. 내가 좋아하는 이 3:  1) 이탈리아 ""트리오"" 환상적인 전망은 식사 중에 실제 beggining 의 모든 표시등 권취온도 부두는 멋진 광경이 라. 양이 작습니다. 우리가 아주 맛있는 랍스터를 먹었는데 spaggheti.  2) 수영장에 있는 인도 음식점. 거대한 부분이며 맛은 훌륭했음. 또한, 직원들은 매우 친절하고 공손했습니다.  3) 그릴에 직냉식냉장고 (이름이 기억나지 않), 모래 해변 이지만 낭만적인 저녁.  일반적으로, 몰디브를 방문한다면, 당신과 많은 옷들을 포기하지 않을 때 하이힐을 포기하지 않지 않길 에 하이힐 카운티까지 걸어갈 수 있는 모래사장. 대부분의 사람들은 이 섬을 맨발로 걸어 다니지!  그들이 도착했을 때는 돈을 예금 답변하기 (신용 카드 또는 현금), 돈 때문에 필요하지 않을 시 숙박을 할 수 있습니다. 것은 필요할 때는 빌라 내 음 하룻밤",5.0
좋은 시간,"환상적인 리조트가 궁금해 하는 전체 서비스 및 특별한 직원들, 특히 아이들과 함께 가족들과 좋은 시간을 가질 수 있습니다. 이 리조트는 정말 놀랍다. 기억에 남는 여행이었습니다. 인도 음식 레스토랑도 매우 좋았어요. 특별한 감사 레스토랑 매니저 모하메드 aswath, 만들어 주는 특별한 준비는. 호텔 직원들은 아주 특별한 느낌을 받을 때 공항에서 부터. Sun siyam 감사합니다.",5.0
신혼여행을 거의 이루 푸쉬 저장할 수 있습니다 ,"우선 말해... 에미레이트 항공 여행 때문입니다 여. 우리는 신혼여행. 저와 제 아내는 임신 7주 동안 그녀는 그냥 먹스를. 두바이를 경유 하는 볼로냐 에서.   대한항공, 가족이 의료 이유 때문입니다 야. 한 시간 뒤, 우리 옆에 앉아 있는 다른 커플 (보고 무료로 업그레이드하여 비즈니스 클래스)에 공황 발작 하기로 했습니다. 에도 불구하고 비행기 승무원 온보드 의사 로 더 이상 말하지, 우리는 3 시간은 에미리트 에어라인 비행기 지연 때문에 잘못된 관리.   이 모든 잘못이 아닙니다 이루 푸쉬. Clear 하게 해 주시기 바랍니다. 그러나...   이루 푸쉬 나는 메시지 (있을 경우 이메일을 디아나 의 사람 이야기)... 우리가 지연될 수 있습니다. 우리는 우리의 첫 번째 밤에 있는 정보를 그리워 할 것을 우리는 호텔에 우리 자신의 회사 비용 웅형 호텔이다.   말레 공항에 도착했을 땐, 저희는 에미레이트 에서 없습니다. 쓸모 groundstaff. 이루 푸쉬 를 발견 사항을 의 대표는 지역 호텔 (우리는 신뢰하지 않는 곳이 없고 인터넷 웅형)...   우리는 하룻밤에 $100 b&b 1 - 스타 체크 인됩니다. 혐오 스럽 됬어요. 뜨거운 물. Tv와. 가끔 인터넷. Emc 는 로컬 레스토랑에 걸어 9pm. 내가 임신 한 아내인 도 없습니다. 저는 절대적으로 혐오.   앞으로, 다음 날. 체크인 데스크에서 아침 비행기 안에서 이루 푸쉬 (20 분 늦게) 그 사람은 모르는 (몇 가지 마지막 밤 비행기 만 해당) 및 앞에 맡겼어야 호텔 이미 정보를 확인할 수 있습니다.   앞으로. 호텔에",4.0
놀라운 5 * 추가 대상,"어떻게 설명 이 멋진 호텔!  우리는 이곳에서 6일 - 7 일 209 비치 빌라, 신혼여행으로. 우리는 한 순간에 필요한 첫 번째 섬. 감사 jaaweedth, 우리가 묵을 만들어 주는 마법의, 모든 것을 가지고 작은 세부 사항, 원하는 곳에서 저녁을 먹었는데, 다시 돌아가서 집 카운티까지 우리를 돕는 티켓! 감사합니다 jaaweedth!  우리 방은 정말 넓었고, 침대도 크고 정말 큰 욕실. 아침 식사는 모든 것을 할 수 있어! 레스토랑은 맛. 저희가 방문한 모든 레스토랑이지만 인도 에서 가장 관대 한 부분, 그래서 우리는 두 번 방문 했습니다! 맛은 훌륭했음 … 이 사람은 정말 감사합니다!  환상적인 해변이 있는 섬 보다 3배 및 라운드. 경로로 깨끗하고 깔끔한 섬. 모래도 매일 swip!  상어 먹이 오후 6 - 7시 프랑스 레스토랑 였습니다.  저녁에 이탈리안 레스토랑 "" 트리오 “해변을 놓치지 마세요. 이 놀라운 밤에!  우리는 환상적인 스노클링 투어 (습니다) 그리고 다이빙 등 은 너무 좋습니다.  스파, 세상이 했습니다!!! 한 사람당 150달러 정도로 가격은 135 가치가 있는데!  여행지 이다. 물론 그 확인 을 보면 정말, 파라다이스 호텔을 제대로 하지 않는 일이지만 (200 달러 및) 로 다.  45분 정도 에 도착할 수 있는 것이 바로 바다가 정말 멋진 비행기!  마지막으로 … 하지만 이상 하지 않습니다 … 많은 사람들이 감사하고 축하를 해결하는 공간의 방은 매일! 매일 아침 아침 식사 후에 우리는 우리 침대에서 신혼여행으로 새 surprice! 저는 사진 첨부!",5.0
새해 ,"정말 놀라운 섬! 남은 시간에 도착한 때부터 기분이 아주 특별한, 이 지구상 어디에도 꽤 아는데, 강요하지 않는다면 가격을 지불할 가치가 있는 것이 인생의 휴가! ",5.0
절대 낙원,"정말 훌륭한 경험이었습니다. 물, 모래, 숙박시설, 식당 직원 waitering 하고. 저희는 총 8박, 비치 빌라와 워터 빌라 2 6 표준에 화려한 리조트는 좋은 경험이었습니다. 비치 빌라 도 정말 편안하고, 조용하고 private 하는 거대한 야외 욕실도 좋았습니다. 또한 필요할 수 있었고 주변에 녹지 들을 위로 하는 해변 몇 단계를 수행하십시오. 빌라는 아주 특별한 바다 경치를, 바닥이 유리로 된 맑고 푸른 물 액세스할 수 있습니다. 유일한 단점은 침대 프레임 교체 거친롤링단계. 침대에 앉아 있는 설정이나 하기 때문에 밤에 잠을 잘 시간이 됩니다 도 어렵고 삐걱 거리 경험. 하지만 우리는 2박을 이 한 방에 가 우리를 귀찮게 하지 않았다. 식당은 매우 높은 수준이 기 때문에 일부 또는 모두 포함되었는데 메뉴가 다양했고. 것이라 너무 많은 음식이 거의 3 요리 점심 & 저녁 식사 주문을 하는 최고의 뷔페식 아침 식사. 하프 보드를 할 수 있는 완벽한 것은 다음 날 음료 모두 액세스할 수 있습니다. 레스토랑 직원들은 더 이상 친절할 수 없는, 그들은 우리에게 이런 기분, 레이첼, jocel, azmin. 단점이 있는 할당된 부틀러. 그는 도움이 되지 않게 하는 편안한 오프 서비스를 최대 20 개로 빌라를 완전히 끝. 저는 그 방식이 오히려 이상한 생각 하나를 왜 했는가? 다행히도 우리는 다른 사람들처럼 높은 유지 보수할 필요가 없었기 때문에 그는 그가 매우 자주 전화를 했다. 우리의 친구들을 볼 수 있는 서비스는 흠 잡을 데 없이 부틀러 주 정말 사람 따라 할당된 것입니다. 하지만 우리가",5.0
