Title,Detail,Rating
편안한 휴일. 거의.,"홀리데이 리조트 로 15 에서 sun 에서 이루지 푸쉬 suyam 2016년 10월 25일. 수영장이 딸린 비치빌라에. 그리고. 일출을 수상.   좋은 점  울창한 식물들 과 함께 큰 섬 (몰디브 섬 과 비교하는) 빌라에 개인 정보 보호를 제공하는 비치.  세계에서 가장 아름다운 바다 중 하나로, 단순수많은 온난한 물 다채로운 물고기 를 근처에 있는 산호초 도착 수 있습니다.  다양한 서비스 의 어떤 종류의 다른 요리 충족할 수 있어야 합니다. 다른 점이 있어서 "" 트리오 "" 레스토랑 중 가장 맛있는 요리. 영국 요리를 하고 이탈리아 요리사의 축하 드립니다.  일반적으로, 모든 직원들은 아주 친절하고 예의 바른 섬. 엘리아, 집사 들이 우리를 동의한 (할당 되지 않았던 것 도 우리에게) 우리를 도와줄 수도, 우리 대신 및 중재 하다, 가능한 경우, 몇 가지지 문제가 발생할 수 있습니다. Chapeau!   나쁜 점  하얀 모래사장, 아름다운 이론상으로는, 하고 있는 부분이 죽은 산호초 및 방청 셀크랩을, 할 수 있는 맨발의 수 없게 되었습니다. 또한, 우리가 머무는 동안 몇 번, 우리는 그들에게 비쳐 바다의 쓰레기 청소 일 (nappies, 유리로 치워, 있습니다). 권한이 있는 불가사용자를 추가하려면 먼저 책임이 it 담당자가 감시 하고 깨끗한 해변. 일부 장소, 해변이 없는 바다 이 완전히 침식, 바닥에 모래 주머니 를 넣어 주는 거대한 문제를 해결해 중지 감소 (그 정도 야 위로 걸어 섬 주위를 계속). 빌라 바로 앞에 위치한 부러움 하지 않는 대신 해변 모래 주머니 의 장벽에. ",3.0
마법의 태양 Siyam,"우리는 태양 에서 siyam 28/12/16 - 2/01/2017. 저희 가족은 성인 과 9살 두 가집니다. 말레 공항에 도착했을 때 호텔 직원이 안내를 해 몰디브 항공 체크 인 국내 비행기는 섬에 있는 공항 섬 ifuru. 우리는 비행기를 기다리는 동안 라운지 를 사용할 수 있는 곳에 에어컨과 음료가 제공되는 작은 뷔페 하고 기다립니다. 비행기를 타는 맛에 또 다른 섬 여행시에 ifuru. 비행 시간 약 45 분 총 합니다. Iru fushi 에서 35분에 스피드 보트는 그런 갔다. 호텔에 도착하자 집사 fiona 만났습니다.   숙박시설 - 우리는 수영장이 딸린 디럭스 비치 빌라 는 완벽한 선택이 하기를. 우리의 방에 프라이버시를 제공됩니다 광고로 울타리 경로를 비치. 다른 빌라 들이 바다가 완전히 노출된 우리의 사랑스러운 빌라 가 풀장에서 보이지만 우리의 전체 개인 정보 보호 정책. 방은 매일 청소가 잘 되어 있으며 모든 요청에 의해 ahusan 챙겨 주었다. 아직도 물 한 병 은 각 방에서 하루를.   할 일이 - 보낼 수영, 스노클링, 및 섬을 걸어 다니는 것. 스노클링 장비를 대여할 수도 없고 시작 또는 다이빙 센터에서 숙박. 오버 워터 빌라 매일 오후 가 남편과 아들이 있는 식당은 맛. 수영장이 있는 조용하고 사랑스러운 가족이지만 깊은 섹션이 되어 얕은 부품을 어린이들. 침대가 칠 선에 많은 신속하게.  반사, 어른 전용 수영장, 일광욕용 침대가 있는 조용한 때 가 많고. 수영을 하고 책을 읽고 가기 좋은 곳.  키즈 클럽도 훌륭했다. 더 많은 조직들은 재미있고 그 느낌이 아주",5.0
파라다이스,"나는 매우 나쁜 리뷰를 떠나지 않는 정상적으로 또는 한. 이런 것입니다. 그것은 믿을 수 없는 경험! 하지만 몰디브에서 가장 큰 섬 중 하나로, 항상 인상을 혼자 섬. 음식은 맛있고, 우리가 모든 레스토랑, 바로 질문 한 것이, 그는 할 수 있는 특별한 맛과 아일랜드의. 일부 의 시도가 얼마나 어려운 요리를 이해하는 높은 수준의 음식을 준비할 수 있는 등 덥고 습한 섬.  방은 크고, 깨끗하고, 놀라운 있어요. 몸 에서 볼 수 있는 엽서 였다.  하고 싶지 않을 때는 모든 사람들도 만날 수 있어서 감사합니다 벌레들이 섬에서 할 수 있는 게 없었지만 잊을 수 없는 것.  아이들과 함께 가서 좋은 곳! 이 중에서 몇 가지 제도 들이 너무 많은 것 같은 느낌이 들지 않 몰디브 허니문 여행지로 적격입니다. 키즈 클럽 은 일.  스파는 훌륭한! 열대 숲 새들의 소리를 들을 수 있는 것 같은 음악과 휴양 입니다. 우리는 우리 아이들은 이 훌륭한 발리 마사지 및 초콜릿 마사지 완전 사랑해요!  이 에 다시 간다면? 그래! 곧!",5.0
내 생의 최고의 휴가,"제가 가 본 중 최고의 리조트. 모든 것이 완벽한 곳이 있는데, 방은 조금 낡았고 가구는 빌라가 변경해야 합니다.   Sammy, 누가 우리를 개최, 우리에게 완벽한 곳 였다. 우리는 멋진 휴가.",5.0
아름다운 위치와 환상적인 리조트,"수상 비행기를 타고 45분 정도 떨어져 있는 이 리조트는 흥미로운 말레 섬은 사진 보다 더 아름답다. 우리는 워터 빌라 들 끝에 있는 환상적인 뷰 및 최종 있었어요 - 중 - 다음 - 세계적인 느낌 입니다. 모든 것이 원활하게 작동하는 섬에 있는 동안 정말 잘 해 주었고, 도착했을 때부터 떠날 때까지. 우리는 이미 돌아가지. (벌레와 모기가 더 넓은 모래사장이 라 빌라. 많이 선호하는 워터 빌라. )",5.0
훌륭한 숙박,"모든 것이 훌륭한 sun siyam. 할 수 없거나 모든 문제, 기대한 것들이 하여, 리셉션 시설, 음식, 활동 빌라에 묵는 훌륭했습니다. 저는 아이들과 함께 다시 한번 방문할 repat",5.0
"놀라운 경험, 놀라운 섬과 환상적인 직원들!","저는 제 가족들과 함께 할 수 있는 sun siyam 생일 축하 하는 리조트가 얼마나 훌륭한지 설명하지! 멋진 섬을 아름답고 깨끗한 해변. 호텔 직원들은 매우 도움이 될 수 있는 것도 필요한. 사미 에게 감사하고 친절하고, 따뜻하고 친절한! 또한, 할 수 있는 다양한 레스토랑은 좋은 음식! 우리의 마음에 드는 것은 이탈리아 레스토랑, 가장 맛있는 메인 요리 몇 가지를 제공 지역의 맛! 방은 아주 깨끗하고 아이들을 가지고 있는 모든 것! 우리는 꼭 다시 sun siyam!",5.0
파라다이스! ,"다락방 & 케리 파이퍼. # sunsiyamirufushi  집에 있는 것 이라고밖에 표현할 수 있어, 가장 놀라운 휴가! Iru fushi 에 정말 감사하여 siyam, 엘리아, deanna, 다니엘, 루이스, 밀로스, 모든 직원들은 한 해 subah. 우리는 우리의 결혼식 갈지 일 vows 의 10 주년 결혼 기념일, 오픈 워터 다이빙 강좌 완료, 제트 스키, 식사, 스노클링도 하고 편안하게 천국!   이는 단순히 천국 에는 사진이 없는 경험이었습니다! 작별 인사 로 시작도 안 했는데. 멋있 다!   저희는 이미 다음 여행 계획!",5.0
놀라운 휴식 장소,나의 신혼여행 였습니다. 저는 정말 좋았어요. 저는 보드를 선택할 수도 있지만 전체가 할 수 있지만 추가 비용이 추가로 그 가치가 있었다.   근사하고 아늑한. 직원들도 좋았어요.   많은 생각이 있다.,5.0
사랑스러운 주 sun siyam,"우리가 예약한 디럭스 비치 빌라에 수영장 시설 하고. 지속적으로 좋은 아침 식사, 저녁 식사를 할 수 있는 다른 레스토랑에서 지원하지만 항상 놀라운 했었습니다 우리가 평균 이하. 온천은 정말 놀라웠습니다. 올 것이 오.",4.0
찾을 수 있는 지상 낙원,"아름다운 섬, 우수한 조건의 숙소, 몰디브에서 가장 큰 스파. 훌륭한 테니스 코트, 부담이 큰 관심 유지 에 있는 직원들. 가격 / 품질이 가능.",5.0
완벽한 파라다이스! ,"이 때 부터 걱정이 하고, 너무 많은 걸 하고, 많은 것을 먹고, 총 11 레스토랑. 환상적인 직원, 매우 친절하고, 개인 주의, 개인 집사 모든 게스트! 객실 수영장, 해변, 모든 것이 코너가 자세히, 야생 동물 도 섬. 과일 박쥐 들이 정말 귀여운, 작게 (그 를 방해하지 않는다) 또한 셀크랩을. 좋은 직원들이 정보에 야생 동물 및 유지 관리 문제인 환경. 나의 친절한 곳!   이 곳은 로얄 치료 받을 때, usd 정도로 있는지 확인합니다. 총 4박을 묵을 내 + 레스토랑 - $5000",5.0
파라다이스,"이 곳은 말 그대로 지상 낙원. 너무나 아름다운 리조트이고 궁금해 해 주신 아름다운 어떻게 만들지 수 있습니다. 리조트의 직원들은 내가 해 본 것 중 최고의 벡 콜. 좋은 리조트, 훌륭한 장소, 좋은 서비스, 좋은 것.",5.0
완벽한 휴가 사진,"이는 우리 가족의 첫 방문 이 아름다운 몰디브 몰디브 파라다이스 및 방문하여. 저와 제 아내는 이 리조트에서 선택이지만 아들도 키즈 클럽을 즐길 것이지만 그 중 가장 중요한 인도양의 몰디브 최고 에 수많은 결과와 iru fushi 교환한 가족 리조트로 세계에서 두 번 수상의 수상 및 글로벌 승자 와 2014 2016 여행 최고의 럭셔리 리조트 2016 수상. 또한 이 서비스는 지정하지 않을 것이라 생각하고 여러 가지 스파 어워드 2016 면에서 전체 공개하지 않는 스파 서비스는 우리가 머무는 동안 자신을 실제로 사용할 수 있습니다. 저는 약 8년 된 리조트 를 이해하는 것. 물과 육지 모두 에 많은 활동을 모두 유지할 수 있는 장소이지만 그 아이들은 어른들과 당신의 활성 도 가능. 우리는 디럭스 빌라에 개인 수영장과 해변을 비치 빌라에서 액세스 미터 떨어져 있습니다. 등록 정보는 정자, 테라스 및 침대 겸용 소파 뒤에 속성 및 속성 하나 프론트 / 비치 사이드. 비가 오는 날이 제공하지만 우리는 우리가 바다에서 수영을 할 수 있는 쾌적하고 따뜻한 날씨가 계속되는 동안 비가 오는 날. 키즈 클럽 은 데 유용한 리소스가 있을 수 있습니다. 제 아내와 저는 제 아들은 제트 스키 도 할 수 후에 키즈 클럽을 보았다. 저희를 보고 저희가 감사 jauzee 만나 dorothy 및 모하메드 와 우리를 환영하는 곳에 있는 수상 비행기에서 내려서 마리암 몰디브와 그녀의 동료들과 (저도 잊지 못해서 작업하여 둘째 날 알았습니다) 항상 미소와 함께 인사를 만나는 모습을 iru 레스토랑. 우리는 가까운 미래에",5.0
한 편안한 숙박,"고급스러운 경험 의 불가사의 열대 산호 섬. 저는 좋은 서비스였지만 여전히 놀라 기대. 나는 짧은 편에 있는 워터 빌라 비치 빌라로 하여, 편안하고 쾌적 하다. Iru fushi 섬에는 많은 레스토랑, 에, 모든 값 - 둘 이상의 iclusive 서비스는 정당화. 말레에서 비행기로 지역 호텔의 트윈 - 수달 이 실제 경험 했고 잘 조직되어 있는 수상 비행기 도 가지고 있었다. 어려움이 findanything. 아마도 워터 제트 수 있기때문에 시끄럽거나 스쿠터 이 한 정장 은 잘 - 최종 리조트 스타일.",5.0
멋진 여행,"친절한 직원들과 아름다운 전망을 방을 유치하여 또 가고 싶네요. 그 집사 전문. 우리는 또한 "" 집을 환영합니다"" 같은 슬로건을 주는 의미 또한 보안 및 다양한 종류의 액티비티를 즐길 수 있는.",5.0
몰디브 아일랜드 파라다이스,"이 완벽한 파라다이스! 수상 비행기는 착륙하는 순간부터 우리는 사랑 을 통해 우리는 알고 있었다. 수정같이 맑은 물 과, 큰 해변, 하얀 모래사장과 부드러운 바다 바람, 아니 전 세계에 있는 것. 비치 빌라에서 묵었는데 개인 풀장. 라운드 모양과 같은 느낌 에 온 - / 아웃도어 - 욕실이 있는 신전 같은 느낌 입니다. 객실은 고급스러운 음식이 세계 - 모든 팔레트의 다른 옵션을 하고. 직원들은 전문가 해당 필드에, 다이빙 센터 등의, 집사 이나 스파. 우리는 더 요구하는 것이 몰디브에서 여행을 할 수 없는 이 모든 사람들에게 추천하고 싶은! 저는 떠나는 것은 슬픈 정보. 제가 이곳에 머물 수 있다면.",5.0
리조트의 손님들이 함께 낙원 주의 최고임!,"저는 이 환상적인 리조트는 이미 그리워 돌아오는 것. 그 특별한 (커플들이 2) 모든 숙박을 하여, 하지만 우리는 특별한 고객들이 매우 만족 했습니다. 우리가 도착했을 때 의 느낌이 정말 너무 고마울 이후 국제 말레 공항, 일부 직원들이 우리를 맞이해 주 때 리조트 체크인을 수상 비행편으로 이동, 및 전체 휴가 내내. 리조트에 도착했을 때, 우리는 환영을 받는 젊은 사람, 그의 이름은 엘리아, 사람의 개인 집사인 한 것을. 엘리아 는 매우 전문적인, 사람을 배려하는 서비스 정신이 모든 문제는 항상 우리를 요청합니다. 긍정적 인 태도가 매우 만족해 그 의 원칙 및. 또한 그는 좋은 리조트 자체! 엘리아 감사합니다! 또한. 루이스 passby 음식과 음료를 훌륭하게 처리 하는 것 중 하나는 이벤트 매니저에게 불행한 일이 발생. 일어날 수 있는 작은 불편함 (약 500명이 있을 때 특히 직원들이) 에서 처리하지만 이 방법이 우리를 더 환영합니다 루이스! 감사합니다. 리조트는 자연적인 섬 가운데 인도양, 낙원 이 비슷한 걸 생각하고 있어요! 하하하 하얀 모래 해변은 푸른 바다 에 둘러싸여 있고 우뚝 솟은 화산의 절경이 그림처럼. 이 파라다이스 가 꽤 많은 유사한 it 입니다. 그래도 할 수 있는 정보들을 묵었어요, 잘. 예약을 안 하는 것이 좋아 ' 파라다이스 ' iru fushi siyam 더 해. 프란체스코 감사합니다",5.0
순수한 천국,"내가 가본 곳 중 가장 좋은 데, 에서 청결함, 친절한 직원들의 도움으로, 뛰어난 음식이 가장 믿을 수 조회 수. 생각이 있는 것을 볼 수 있었지만 안내선 가능 siyam iru fushi 의 색깔과 완전함 을 정말 한 안내 책자가 되는 현실.",5.0
가장 기억에 남는 가족 여행,"이 리조트는 많이 제공. 많은 레스토랑, 스파, 수상 스포츠 활동. 꽤 큰 크기, 느끼지 못할 것 같은 손님을 너무 많습니다. 저는 개인적으로 이 좋아.  유일한 단점은, 주위에 물고기들이 많지 않습니다.",5.0
낙원 같은 느낌,"우리의 여행은 처음 거였어요. 꼭 우리의 마지막 하나. 우리는 이 리조트에서 매일 사랑. 이 섬은 멋진: 하얀 모래사장, 맑은 물 아름다운 빌라. 음식은 다양하고 우수한 품질 은 믿을 수 없을만큼 제공할 수 있습니다. 하지만 머무는 직원들과 잊지 못할 특별한 감사는 모하메드, yoosuf, 그리고 eemaaz ghadir.  가능한 한 빨리 다시 갈 걸지 사용자_이름:.",5.0
아주 나쁜 서비스 및 인터넷 연결은 매우 가난한,저희는 정말 만족스러운 서비스 제공을 비치 빌라에 인터넷 연결은 매우 가난한 우리를 실망시키지 않았습니다. 우리는 우리의 의견 카운티까지 좋은 사람을 위해 희망 / 작업을 수행할 수 있습니다.,2.0
"이 천국은, 모든 것이 퍼스트 클래스 놓칠 수 없는","우리는 몰디브로 처음 오는 6일 예약을 하고 6 일 디럭스 비치 빌라 와 워터 빌라 호라이즌 풀장. 둘 다 훌륭한 방법이 더 있는 자체 비치빌라는 훌륭한 개인 해변에 걸어 나가, 개인 수영장과 일광욕 공간. 모든 등록 정보의 아주 수준이 높습니다. 직원들은 아주 친절하게 할 수 없습니다. 아침 식사는 선택할 수 있는 다양한 음식점들은 전에 본 적이 없고 모든 일이 결정. 프랑스 가 우리를 좋아하는, 아니 했었습니다 함께 온 다음, 그 맛을 인도 및 베트남어. 그리고 기억나는 밀라 니즈 하는 큰 닭 이 되어. 선택의 폭이 넓고 다양한 요리를 아주 잘 할 수 있다. 난 특별한 언급 을 스티븐, dorothy, 루이스, 자릴, 그리고 많은 사람들에게 hersherm 에 환영의 분위기를 찾아. 가재는 가재는 그보다 훨씬 맛있어 한 바비큐 하는 가재 를 영국.   다시 돌아올 것이니, 이미 내년 예약까지 작업. Sun siyam 잘 했어요.",5.0
호텔은 어린이 동반 가족,"멋진 호텔, 멋진 객실, 친절한 직원들이 충분히, 항상 미소로 도움이 greating! 시설도 정말 좋은 분들이 좋은, tennisc​​ourts, 가격 대비 훌륭한 호텔 스파 투어 들 입니다. 우리가 머무는 게 아직은 아이들의 최고의 휴가 중 하나를 이해: 우선 아이들이 먹고 있을 때 직원들은 항상 무료로 함께 해 주고 어른들도 아주 빠르고 품질 및 선택이 정말 정말 좋았어요. 유일한 실망스러운 방 청소하는 것, 나쁜 했습니다. 불평 할 수 있게 만들어 주고 청소하는 직원들, 하지만 우리는 모든 것이 귀찮게하지 않았다 때문에 놀라운 (나쁜 것을 그리지 않으므로 해당 예제에 있는 빈 샴푸 용기들, 은 행복하지 않은 우리를 귀찮게 제거되지 않음: - )   멋진 호텔, 좋은 직원들이 우리 아이들에게 어떤 한 친구가 우리 가족은 씨 의 집사 와 아슈 파크 (젊은 집사 와 함께 하는 놀라운 재능 을 세계에 발) 를 만나보 았습니다. 우리는 호텔 직원들이 잘 가 한다는 느낌을 많이 해 주!",5.0
좋은 가격 & 품질,"지불하지 않은 유일한 & 하지만 resiveing 같은 것 같아요.  아주 좋은 장소 입니다. 하지만 이 정도의 경우에는 먼저 베트 전송, iru fushi 물론 이 만든 몇 가지 할 수 있는 작은 아이들이 특히 랜딩스 호텔 가져오기 전에 여행.  Iru fushi 는 sun siyam 좋습니다. 나는.",4.0
그만한 가치가 있는,"몰디브는 휴가를 아주 저렴한 가격에 높은 수준의 모든 것을 할 수 있고 필요 시 돈이 아깝지 않았어요. 제 경험으로는 그만한 가치가 있는 sun siyam 에서 제공하는 표준 이다. 심각하게, 잘못 이 있는 것이 마음에 들어요. 감사하기를 잊지 못할 추억! ",5.0
완벽한 가족 휴가!,"가족과 함께 크리스마스 iru fushi sun siyam beutiful 보냈습니다. 아름다운 해변의 모래 사장, 훌륭한 레스토랑이 제공하는 다양하기 에서 cusines, 아름다운 5 - 스타 를 우리는 스파 및 전담 직원의 후. 특별한 경험을 우리의 휴가를 아주 특별한 독특한. 아이들과 함께 가족들에게 완전 추천!",5.0
가족 여행,"우리는 1월 10일부터 패밀리 풀 빌라. 남편과 아이들이 우리의 4 가 충분한 다. 빌라는 아주 좋은 위치, 몇 단계를 비치. 리조트는 아주 좋고 또 풀 2. 키즈 클럽 은 너무나 멋진 직원들도 마찬가지 였다. 그 아이들은 정말 마음에 드는 많은 시간을 보내고 있습니다. 많은 것들을 해줄. 유일한 단점은 리조트에 예약을 하는 매우 어려운 중 메인 레스토랑은 다른 레스토랑 또한 훌륭했습니다. 9 일 만에 1 섬에서 할 수 있는 예약을 얻었습니다. 절대적으로 놀라운 설정은 정직한 음식은 평균적이지만 아주 가난한 서비스.",5.0
잊을 수없는 휴가 … 정말 최고의 리조트,"저는 정말 많은 곳이 훨씬 좋은 곳 중 하나. 놀라운 자연 이지만 뛰어난 서비스 뿐만 아니라 복제 과정에서 확실한 입니다. 뷔페식 아침 식사는 놀라운. 한 해 우리는 우리의 개인 버틀러 jipson 마치 꿈같은 경험. 6명이 사용할 수 있다, 아이들과 함께 온 가족 2 상위 태그 2. 우리는 공을 갖고 있다. 매일 우리 중에는 놀라운 잊을 수 없는 경험. 10 년 동안 34 년 을 함께 한 우리의 결혼 기념일 에, 아름다운 꽃 장식 을 준비할 때 저희의 저녁 식사 케이크 jipson. 이 중 하나의 하드 도 잊지 못해 정말 감사합니다. 우리는 꼭 다시 방문할 수 있는 :)",5.0
파라다이스,"선셋 워터 빌라는 환상적인 시간에 온 호라이즌. 객실, 시설, 자쿠지, 액세스할 수가 없어요. 이 섬은 멋진, 완벽한 날씨는, 햇볕 siyam 음식점 시설과 흠잡을 곳이. 우리는 모든 - 요금 일체 포함 패키지 가 좋았습니다 - 선택을 마시는 모든 항목을 포함하는 합리적인 선택인 폭 넓은 기능 에서 각 음식의 레스토랑도 좋았습니다.",5.0
"놀라운 리조트, 최고의 여행지 & 훌륭한 서비스!","제가 가본 곳 중 최고 였습니다. 호텔 리조트는 가치가 있습니다! 서비스도 좋았고, 리조트가 사람으로 붐비는, 우리가 묵었던 방갈로는 물 위에 가장자리. 놀라운 바다, 너무나 많은 해양 생물이 다. 음식도 최고, 하지만 약간 비싸고 음식을 얼마나 열심히 섬 합니다. 몰디브 최고의 요리 하게 할 수 있었다. 우리는 사진을 찍는 사진 작가인 개발 회사도 저렴해서 정말 많은 추억. 몰디브의 이 리조트를 적극 추천합니다!",5.0
비싼 음식 이지만 완벽한 숙박!,"호텔의 직원들은 모두 우리가 집처럼 느껴지는 완벽 했습니다 특히 및 만달, 버기 드라이버 :). Iru fushi 에 있는 선에서 아주 멋진 경험 이지만 정당 하지 않은 문제는 전반적으로 비싼 음식 siyam.",4.0
지상 낙원,"남편과 저는 여행을 기념하기 위해서 우리가 21 & 결혼 기념일로 이 곳이 바로 &!   여행사 에 대해 잘못된 정보를 제공해 주고 숙박시설 - 우리는 자신을 발견하고 패밀리 디럭스 비치 빌라 와 수영장, 일출 보기를 즐기고 있는   이 같은 개인 머물러 본 다른 아무것도 - 완벽한 휴가를 보내고 있는 유형. (아기도 있고 불행한 일 이 되어 우리 옆에 있습니다. 내 어머니의 평온함을 넘어 본 그의 단절이 확인할 & 직각력)   보기, 섬, 리조트, 가든 & 시설이 매우 잘 관리된 r. 제가 읽은 리뷰 제공하지만 보다 낮은 표준 때문이라고 했고 나는 그가 여기에 결점이 없는 힐튼 호텔. 제가 묵었던 리조트 월드 와이드.   직원들이 인상적인 호텔 입니다. 조용하고, 수동 & 달콤한. 무엇 보다도, 이러한 전문. 방의 욕조와 거품 꽃잎 & 유지 보수 사람 우리 를 실행하여 질문. 저를 이 녹아.   않을까 비싼 호텔이었기 때문에 리뷰를 읽고 준비한. 저는 깜짝 놀랐습니다. 저녁 식사를 한 사람 당 $50 에 평균 이 2 코스. 점심 식사를 하고, 주위에, $30. 음료 부터 최대 $9 년은 맛이 싶네요. 칵테일 이 12 에서 $25 정도.   스파는 작은 그 가격이 다. 우리 부부는 한 사람 당 $135 핫 스톤 마사지 로 약 $330 에 놀랄 &. 서비스 요금에 세금이 포함되지 않게 쓰인 가격에 r & 브로셔. 이는 것을 지켜보   마지막 밤, 손님들을 초대 해 주는 직원들이 손님들과 함께 칵테일 아워 가 섞이지 었다. 제가 만난 루크, 음식 & 음료 관리자에게 칭찬해 높은 수준의 음식의",5.0
지상 낙원,"독점 할 수 있다. 위치, 비치 디럭스 빌라, 날씨, 직원, 음식이 더 잘 할 수 없습니다. 신혼여행을 그리워 하는 듯한 느낌을 우리는 다시 올 것이 우리 친구들이 우리 아이들과 함께 떠나는 좋은 코멘트에 h 텔 추천 트립어드바이저",5.0
모든 것이 완벽한,장애가 없습니다. 품질 및 고급스런 서비스. 모든 직원들이 매우 세심한 에스. 방은 넓었고 confortables. 살 럭셔리 호텔 최대 다. 놀라운 해변. 다양한 수상 활동. 절대적으로 추천 커플 familias.,5.0
의 작은 천국,Iru fushi siyam 에서 네 번째는 태양이 지 마지막 입니다. 이 리조트는 올해 처음 연 이후 개선 때 여전히 바이 힐튼 runned. 이 리조트에서 공항 라운지에서 휴식을 취하는 이미 시작 및 끝 의 남자.,5.0
